id,movie_name,ranking,award_year,award_name1,award_name2,award_name3,award_name4,award_name5,award_name6,award_name7,release_year,running_time,storyline,user_rating,critic_rating,genre1,genre2,genre3,genre4,genre5,genre6,genre7,imgurl
1,The Hurt Locker,1956,2010,Best Motion Picture of the Year,Best Achievement in Directing,"Best Writing, Original Screenplay",Best Achievement in Film Editing,Best Achievement in Sound Mixing,Best Achievement in Sound Editing,,2008,2h 11min,"An intense portrayal of elite soldiers who have one of the most dangerous jobs in the world: disarming bombs in the heat of combat. When a new sergeant, James, takes over a highly trained bomb disposal team amidst violent conflict, he surprises his two subordinates, Sanborn and Eldridge, by recklessly plunging them into a deadly game of urban combat, behaving as if he's indifferent to death. As the men struggle to control their wild new leader, the city explodes into chaos, and James' true character reveals itself in a way that will change each man forever. —BWR Public Relations",7.5,9.5,Drama,Thriller,War,,,,,"https://m.media-amazon.com/images/M/MV5BYWYxZjU2MmQtMmMzYi00ZWUwLTg2ZWQtMDExZTVlYjM3ZWM1XkEyXkFqcGdeQXVyNzkwMjQ5NzM@._V1_QL75_UX190_CR0,2,190,281_.jpg"
2,Crazy Heart,4544,2010,Best Performance by an Actor in a Leading Role,"Best Achievement in Music Written for Motion Pictures, Original Song",,,,,,2009,1h 52min,"Bad Blake is a broken-down, hard-living country music singer who's had way too many marriages, far too many years on the road and one too many drinks way too many times. And yet, Bad can't help but reach for salvation with the help of Jean, a journalist who discovers the real man behind the musician. —Fox Searclight Pictures",7.2,8.3,Drama,Music,Romance,,,,,"https://m.media-amazon.com/images/M/MV5BMTU0NDc5NjgzNl5BMl5BanBnXkFtZTcwNzc0NDIzMw@@._V1_QL75_UY281_CR0,0,190,281_.jpg"
3,The Blind Side,815,2010,Best Performance by an Actress in a Leading Role,,,,,,,2009,2h 9min,"Based on the true story of Leigh Anne Tuohy and Sean Tuohy who take in a homeless teenage African-American, Michael Oher. Michael has no idea who his father is and his mother is a drug addict. Michael has had little formal education and few skills to help him learn. Leigh Anne soon takes charge however, as is her nature, ensuring that the young man has every opportunity to succeed. When he expresses an interest in football, she goes all out to help him, including giving the coach a few ideas on how best to use Michael's skills. They not only provide him with a loving home, but hire a tutor to help him improve his grades to the point where he would qualify for an NCAA Division I athletic scholarship. Michael Oher was the first-round pick of the Baltimore Ravens in the 2009 NFL draft. —garykmcd",7.6,5.3,Biography,Drama,Sport,,,,,"https://m.media-amazon.com/images/M/MV5BMjEzOTE3ODM3OF5BMl5BanBnXkFtZTcwMzYyODI4Mg@@._V1_QL75_UX190_CR0,1,190,281_.jpg"
4,Inglourious Basterds,183,2010,Best Performance by an Actor in a Supporting Role,,,,,,,2009,2h 33min,"In German-occupied France, young Jewish refugee Shosanna Dreyfus witnesses the slaughter of her family by Colonel Hans Landa. Narrowly escaping with her life, she plots her revenge several years later when German war hero Fredrick Zoller takes a rapid interest in her and arranges an illustrious movie premiere at the theater she now runs. With the promise of every major Nazi officer in attendance, the event catches the attention of the ""Basterds"", a group of Jewish-American guerrilla soldiers led by the ruthless Lt. Aldo Raine. As the relentless executioners advance and the conspiring young girl's plans are set in motion, their paths will cross for a fateful evening that will shake the very annals of history. —The Massie Twins",8.3,6.9,Adventure,Drama,War,,,,,"https://m.media-amazon.com/images/M/MV5BOTJiNDEzOWYtMTVjOC00ZjlmLWE0NGMtZmE1OWVmZDQ2OWJhXkEyXkFqcGdeQXVyNTIzOTk5ODM@._V1_QL75_UX190_CR0,0,190,281_.jpg"
5,Precious,4077,2010,Best Performance by an Actress in a Supporting Role,"Best Writing, Adapted Screenplay",,,,,,2009,1h 50min,"In Harlem, 1987. Sixteen year old Claireece Jones - who goes by her middle name Precious - is illiterate and overweight. She is pregnant with her second child, both children fathered by her biological father, who has continually raped her since she was a child, but who she doesn't see otherwise. Her infant daughter, Mongo - such named since she has Down Syndrome - lives with Precious' grandmother. Precious lives with her mother Mary, who abuses Precious both physically and emotionally. Mary does nothing but smoke, watch television and collect welfare through fraud (as she doesn't ever look for a job) and believes that education does nothing for Precious, who she would rather also collect welfare if only to bring money into the household. To escape her life, Precious often daydreams of herself in glamorous situations. Because of her current pregnancy, Precious' principal transfers her into an alternative school. In dealing with the school's sympathetic teacher Miss Blu Rain, Precious begins to believe that she can have a future by learning how to read and write. Despite some devastating news from her mother following the birth of her child, Precious also begins to believe she can escape the grips of her abusive mother, who, up to this point, was Precious' only real support. —Huggo",7.3,7.8,Drama,,,,,,,"https://m.media-amazon.com/images/M/MV5BMTk3NDM4ODMwNl5BMl5BanBnXkFtZTcwMTYyNDIzMw@@._V1_QL75_UX190_CR0,2,190,281_.jpg"