id,movie_name,ranking,award_year,award_name1,award_name2,award_name3,award_name4,award_name5,award_name6,award_name7,release_year,running_time,storyline,user_rating,critic_rating,genre1,genre2,genre3,genre4,genre5,genre6,genre7,imgurl
1,The Hurt Locker,1956,2010,Best Motion Picture of the Year,Best Achievement in Directing,"Best Writing, Original Screenplay",Best Achievement in Film Editing,Best Achievement in Sound Mixing,Best Achievement in Sound Editing,,2008,2h 11min,"An intense portrayal of elite soldiers who have one of the most dangerous jobs in the world: disarming bombs in the heat of combat. When a new sergeant, James, takes over a highly trained bomb disposal team amidst violent conflict, he surprises his two subordinates, Sanborn and Eldridge, by recklessly plunging them into a deadly game of urban combat, behaving as if he's indifferent to death. As the men struggle to control their wild new leader, the city explodes into chaos, and James' true character reveals itself in a way that will change each man forever. —BWR Public Relations",7.5,9.5,Drama,Thriller,War,,,,,"https://m.media-amazon.com/images/M/MV5BYWYxZjU2MmQtMmMzYi00ZWUwLTg2ZWQtMDExZTVlYjM3ZWM1XkEyXkFqcGdeQXVyNzkwMjQ5NzM@._V1_QL75_UX190_CR0,2,190,281_.jpg"
2,Crazy Heart,4544,2010,Best Performance by an Actor in a Leading Role,"Best Achievement in Music Written for Motion Pictures, Original Song",,,,,,2009,1h 52min,"Bad Blake is a broken-down, hard-living country music singer who's had way too many marriages, far too many years on the road and one too many drinks way too many times. And yet, Bad can't help but reach for salvation with the help of Jean, a journalist who discovers the real man behind the musician. —Fox Searclight Pictures",7.2,8.3,Drama,Music,Romance,,,,,"https://m.media-amazon.com/images/M/MV5BMTU0NDc5NjgzNl5BMl5BanBnXkFtZTcwNzc0NDIzMw@@._V1_QL75_UY281_CR0,0,190,281_.jpg"
3,The Blind Side,815,2010,Best Performance by an Actress in a Leading Role,,,,,,,2009,2h 9min,"Based on the true story of Leigh Anne Tuohy and Sean Tuohy who take in a homeless teenage African-American, Michael Oher. Michael has no idea who his father is and his mother is a drug addict. Michael has had little formal education and few skills to help him learn. Leigh Anne soon takes charge however, as is her nature, ensuring that the young man has every opportunity to succeed. When he expresses an interest in football, she goes all out to help him, including giving the coach a few ideas on how best to use Michael's skills. They not only provide him with a loving home, but hire a tutor to help him improve his grades to the point where he would qualify for an NCAA Division I athletic scholarship. Michael Oher was the first-round pick of the Baltimore Ravens in the 2009 NFL draft. —garykmcd",7.6,5.3,Biography,Drama,Sport,,,,,"https://m.media-amazon.com/images/M/MV5BMjEzOTE3ODM3OF5BMl5BanBnXkFtZTcwMzYyODI4Mg@@._V1_QL75_UX190_CR0,1,190,281_.jpg"
4,Inglourious Basterds,183,2010,Best Performance by an Actor in a Supporting Role,,,,,,,2009,2h 33min,"In German-occupied France, young Jewish refugee Shosanna Dreyfus witnesses the slaughter of her family by Colonel Hans Landa. Narrowly escaping with her life, she plots her revenge several years later when German war hero Fredrick Zoller takes a rapid interest in her and arranges an illustrious movie premiere at the theater she now runs. With the promise of every major Nazi officer in attendance, the event catches the attention of the ""Basterds"", a group of Jewish-American guerrilla soldiers led by the ruthless Lt. Aldo Raine. As the relentless executioners advance and the conspiring young girl's plans are set in motion, their paths will cross for a fateful evening that will shake the very annals of history. —The Massie Twins",8.3,6.9,Adventure,Drama,War,,,,,"https://m.media-amazon.com/images/M/MV5BOTJiNDEzOWYtMTVjOC00ZjlmLWE0NGMtZmE1OWVmZDQ2OWJhXkEyXkFqcGdeQXVyNTIzOTk5ODM@._V1_QL75_UX190_CR0,0,190,281_.jpg"
5,Precious,4077,2010,Best Performance by an Actress in a Supporting Role,"Best Writing, Adapted Screenplay",,,,,,2009,1h 50min,"In Harlem, 1987. Sixteen year old Claireece Jones - who goes by her middle name Precious - is illiterate and overweight. She is pregnant with her second child, both children fathered by her biological father, who has continually raped her since she was a child, but who she doesn't see otherwise. Her infant daughter, Mongo - such named since she has Down Syndrome - lives with Precious' grandmother. Precious lives with her mother Mary, who abuses Precious both physically and emotionally. Mary does nothing but smoke, watch television and collect welfare through fraud (as she doesn't ever look for a job) and believes that education does nothing for Precious, who she would rather also collect welfare if only to bring money into the household. To escape her life, Precious often daydreams of herself in glamorous situations. Because of her current pregnancy, Precious' principal transfers her into an alternative school. In dealing with the school's sympathetic teacher Miss Blu Rain, Precious begins to believe that she can have a future by learning how to read and write. Despite some devastating news from her mother following the birth of her child, Precious also begins to believe she can escape the grips of her abusive mother, who, up to this point, was Precious' only real support. —Huggo",7.3,7.8,Drama,,,,,,,"https://m.media-amazon.com/images/M/MV5BMTk3NDM4ODMwNl5BMl5BanBnXkFtZTcwMTYyNDIzMw@@._V1_QL75_UX190_CR0,2,190,281_.jpg"
6,Avatar,340,2010,Best Achievement in Cinematography,Best Achievement in Art Direction,Best Achievement in Visual Effects,,,,,2009,2h 42min,"When his brother is killed in a robbery, paraplegic Marine Jake Sully decides to take his place in a mission on the distant world of Pandora. There he learns of greedy corporate figurehead Parker Selfridge's intentions of driving off the native humanoid ""Na'vi"" in order to mine for the precious material scattered throughout their rich woodland. In exchange for the spinal surgery that will fix his legs, Jake gathers knowledge, of the Indigenous Race and their Culture, for the cooperating military unit spearheaded by gung-ho Colonel Quaritch, while simultaneously attempting to infiltrate the Na'vi people with the use of an ""avatar"" identity. While Jake begins to bond with the native tribe and quickly falls in love with the beautiful alien Neytiri, the restless Colonel moves forward with his ruthless extermination tactics, forcing the soldier to take a stand - and fight back in an epic battle for the fate of Pandora. —The Massie Twins",7.8,8.3,Action,Adventure,Fantasy,Sci-Fi,,,,"https://m.media-amazon.com/images/M/MV5BMTYwOTEwNjAzMl5BMl5BanBnXkFtZTcwODc5MTUwMw@@._V1_QL75_UX190_CR0,0,190,281_.jpg"
7,The Young Victoria,1,2010,Best Achievement in Costume Design,,,,,,,2009,1h 45min,"Dominated by her possessive mother and her bullying consort, Conroy, since childhood, teen-aged Victoria refuses to allow them the power of acting as her regent in the last days of her uncle William IV's rule. Her German cousin Albert is encouraged to court her for solely political motives, but, following her accession at age eighteen, finds he is falling for her and is dismayed at her reliance on trusty Prime Minister Melbourne. Victoria is impressed by Albert's philanthropy, which is akin to her own desire to help her subjects. However, her loyalty to Melbourne, perceived as a self-seeker, almost causes a constitutional crisis, and it is Albert who helps restore her self-confidence. She proposes and they marry, Albert proving himself not only a devoted spouse, prepared to take an assassin's bullet for her, but also an agent of much-needed reform, finally endorsed by an admiring Melbourne. —don @ minifie-1",7.3,6.4,Biography,Drama,History,Romance,,,,"https://m.media-amazon.com/images/M/MV5BMTM4MjExMDk3NV5BMl5BanBnXkFtZTcwMTU3OTMwMw@@._V1_QL75_UX190_CR0,6,190,281_.jpg"
8,Up,1186,2010,"Best Achievement in Music Written for Motion Pictures, Original Score",Best Animated Feature Film of the Year,,,,,,2009,1h 36min,"As a boy, Carl Fredricksen wanted to explore South America and find the forbidden Paradise Falls. About 64 years later he gets to begin his journey along with Boy Scout Russell by lifting his house with thousands of balloons. On their journey, they make many new friends including a talking dog, and figure out that someone has evil plans. Carl soon realizes that this evildoer is his childhood idol.",8.2,8.8,Animation,Adventure,Comedy,Drama,Family,,,"https://m.media-amazon.com/images/M/MV5BMTk3NDE2NzI4NF5BMl5BanBnXkFtZTgwNzE1MzEyMTE@._V1_QL75_UX190_CR0,2,190,281_.jpg"
9,Logorama,2,2010,"Best Short Film, Animated",,,,,,,2009,16min,"Somewhere in a vibrant and colourful interpretation of sunny Los Angeles where corporate logos and mascots simply rule, a sexy Esso Girl waitress takes her cigarette break, while at the same time, a murderous, gun-totting Ronald McDonald runs amok on the busy highways. As the clear signs of a vehement seismic activity foretell an ominous future, will the Michelin Man police officers stop the unhinged psychopath before he blows the whole town to smithereens? —Nick Riganas",7.5,0,Animation,Short,Action,Comedy,Crime,,,"https://m.media-amazon.com/images/M/MV5BNzQxNTIyODAxMV5BMl5BanBnXkFtZTgwNzQyMDA3OTE@._V1_QL75_UX190_CR0,0,190,281_.jpg"
10,The New Tenants,3,2010,"Best Short Film, Live Action",,,,,,,2009,21min,"A prying neighbor, a glassy-eyed drug dealer, and a husband brandishing both a weapon and a vendetta make up the welcome wagon. Set amidst the as-yet-unopened boxes and the hopes for a fresh start of two men on what might just be the worst moving day ever. Their new apartment reveals its terrifying history in a film that is by turns funny, frightening, and unexpectedly romantic. —Anonymous",6.9,0,Short,Comedy,Crime,Drama,,,,"https://m.media-amazon.com/images/M/MV5BZGJhNWRiOWQtMjI4OS00ZjcxLTgwMTAtMzQ2ODkxY2JkOTVlXkEyXkFqcGdeQXVyMTkxNjUyNQ@@._V1_QL75_UX190_CR0,0,190,281_.jpg"
11,Music by Prudence,4,2010,"Best Documentary, Short Subjects",,,,,,,2010,33min,,7.1,0,Documentary,Short,Biography,Music,,,,"https://m.media-amazon.com/images/M/MV5BNGNiNWQ5M2MtNGI0OC00MDA2LWI5NzEtMmZiYjVjMDEyOWYzXkEyXkFqcGdeQXVyMjM4NTM5NDY@._V1_QL75_UX190_CR0,0,190,281_.jpg"
12,The Cove,5,2010,"Best Documentary, Features",,,,,,,2009,1h 32min,"Richard O'Barry was the man who captured and trained the dolphins for the television show Flipper (1964). O'Barry's view of cetaceans in captivity changed from that experience when as the last straw he saw that one of the dolphins playing Flipper - her name being Kathy - basically committed suicide in his arms because of the stress of being in captivity. Since that time, he has become one of the leading advocates against cetaceans in captivity and for the preservation of cetaceans in the wild. O'Barry and filmmaker 'Louie Psihoyos (I)' go about trying to expose one of what they see as the most cruel acts against wild dolphins in the world in Taiji, Japan, where dolphins are routinely corralled, either to be sold alive to aquariums and marine parks, or slaughtered for meat. The primary secluded cove where this activity is taking place is heavily guarded. O'Barry and Psihoyos are well known as enemies by the authorities in Taiji, the authorities who will use whatever tactic to expel the two from Japan forever. O'Barry, Psihoyos and their team covertly try to film as a document of conclusive evidence this cruel behavior. They employ among others Hollywood cameramen and deep sea free divers. They also highlight what is considered the dangerous consumption of dolphin meat (due to its high concentration of mercury) which is often sold not as dolphin meat, and the Japanese government's methodical buying off of poorer third world nations for their support of Japan's whaling industry, that support most specifically at the International Whaling Commission. —Huggo",8.4,8.4,Documentary,Biography,Crime,History,,,,"https://m.media-amazon.com/images/M/MV5BMzM3NTRhMTctNTE2MS00YjJmLWE2ZmMtMmY3MWI0ODExMTMzXkEyXkFqcGdeQXVyNTA4NzY1MzY@._V1_QL75_UY281_CR5,0,190,281_.jpg"
13,El Sikeuleto: Bimil-ui Nundongja,2351,2010,Best Foreign Language Film of the Year,,,,,,,2009,2h 9min,"In 1999, retired Argentinian federal justice agent Benjamín Espósito is writing a novel, using an old closed case as the source material. That case is the brutal rape and murder of Liliana Coloto. In addition to seeing the extreme grief of the victim's husband Ricardo Morales, Benjamín, his assistant Pablo Sandoval, and newly hired department chief Irene Menéndez-Hastings were personally affected by the case as Benjamín and Pablo tracked the killer, hence the reason why the unsatisfactory ending to the case has always bothered him. Despite the department already having two other suspects, Benjamín and Pablo ultimately were certain that a man named Isidoro Gómez is the real killer. Although he is aware that historical accuracy is not paramount for the novel, the process of revisiting the case is more an issue of closure for him. He tries to speak to the key players in the case, most specifically Irene, who still works in the justice department and who he has always been attracted to but never pursued due to the differences in their ages and social classes. The other issue is that Gómez is still at large, no one aware if he is alive or dead. But as Pablo at the time mentioned that passion is one thing that cannot be changed in behavior, Benjamín learns now that that premise still holds true. —Huggo",8.2,8,Drama,Mystery,Romance,Thriller,,,,"https://m.media-amazon.com/images/M/MV5BY2FhZGI5M2QtZWFiZS00NjkwLWE4NWQtMzg3ZDZjNjdkYTJiXkEyXkFqcGdeQXVyMTMxODk2OTU@._V1_QL75_UY281_CR1,0,190,281_.jpg"
14,Star Trek: The Beginning,198,2010,Best Achievement in Makeup,,,,,,,2009,2h 7min,"On the day of James T. Kirk's birth, his father dies on his damaged starship in a last stand against a Romulan mining vessel looking for Ambassador Spock, who in this time, has grown on Vulcan disdained by his neighbors for his half-human heritage. 25 years later, James T. Kirk has grown into a young rebellious troublemaker. Challenged by Captain Christopher Pike to realize his potential in Starfleet, he comes to annoy academy instructors like Commander Spock. Suddenly, there is an emergency on Vulcan and the newly-commissioned USS Enterprise is crewed with promising cadets like Nyota Uhura, Hikaru Sulu, Pavel Chekov and even Kirk himself, thanks to Leonard McCoy's medical trickery. Together, this crew will have an adventure in the final frontier where the old legend is altered forever as a new version of the legend begins. —Paramount Pictures",7.9,8.2,Action,Adventure,Sci-Fi,,,,,"https://m.media-amazon.com/images/M/MV5BMjE5NDQ5OTE4Ml5BMl5BanBnXkFtZTcwOTE3NDIzMw@@._V1_QL75_UX190_CR0,0,190,281_.jpg"
15,The King's Speech,2053,2011,Best Motion Picture of the Year,Best Performance by an Actor in a Leading Role,Best Achievement in Directing,"Best Writing, Original Screenplay",,,,2010,1h 58min,"Britain's Prince Albert (Colin Firth) must ascend the throne as King George VI, but he has a speech impediment. Knowing that the country needs her husband to be able to communicate effectively, Elizabeth (Helena Bonham Carter) hires Lionel Logue (Geoffrey Rush), an Australian actor and speech therapist, to help him overcome his stammer. An extraordinary friendship develops between the two men, as Logue uses unconventional means to teach the monarch how to speak with confidence. —Jwelch5742",8,8.8,Biography,Drama,History,,,,,"https://m.media-amazon.com/images/M/MV5BMzU5MjEwMTg2Nl5BMl5BanBnXkFtZTcwNzM3MTYxNA@@._V1_QL75_UY281_CR1,0,190,281_.jpg"
16,Black Swan,404,2011,Best Performance by an Actress in a Leading Role,,,,,,,2010,1h 48min,"Nina (Portman) is a ballerina in a New York City ballet company whose life, like all those in her profession, is completely consumed with dance. She lives with her obsessive former ballerina mother Erica (Hershey) who exerts a suffocating control over her. When artistic director Thomas Leroy (Cassel) decides to replace prima ballerina Beth MacIntyre (Ryder) for the opening production of their new season, Swan Lake, Nina is his first choice. But Nina has competition: a new dancer, Lily (Kunis), who impresses Leroy as well. Swan Lake requires a dancer who can play both the White Swan with innocence and grace, and the Black Swan, who represents guile and sensuality. Nina fits the White Swan role perfectly but Lily is the personification of the Black Swan. As the two young dancers expand their rivalry into a twisted friendship, Nina begins to get more in touch with her dark side - a recklessness that threatens to destroy her. —Fox Searchlight Pictures",8,7.9,Drama,Thriller,,,,,,"https://m.media-amazon.com/images/M/MV5BNzY2NzI4OTE5MF5BMl5BanBnXkFtZTcwMjMyNDY4Mw@@._V1_QL75_UX190_CR0,0,190,281_.jpg"
17,The Fighter,2066,2011,Best Performance by an Actor in a Supporting Role,Best Performance by an Actress in a Supporting Role,,,,,,2010,1h 56min,"The Fighter is a drama about boxer ""Irish"" Micky Ward's unlikely road to the world light welterweight title. His Rocky-like rise was shepherded by half-brother Dicky, a boxer-turned-trainer on the verge of being KO'd by drugs and crime. —anonymous",7.8,7.9,Biography,Drama,Sport,,,,,"https://m.media-amazon.com/images/M/MV5BMTM0ODk3MjM1MV5BMl5BanBnXkFtZTcwNzc1MDIwNA@@._V1_QL75_UX190_CR0,8,190,281_.jpg"
18,Sosyeol neteuwokeu,377,2011,"Best Writing, Adapted Screenplay",Best Achievement in Film Editing,"Best Achievement in Music Written for Motion Pictures, Original Score",,,,,2010,2h,"On a fall night in 2003, Harvard undergrad and computer programming genius Mark Zuckerberg sits down at his computer and heatedly begins working on a new idea. In a fury of blogging and programming, what begins in his dorm room soon becomes a global social network and a revolution in communication. A mere six years and 500 million friends later, Mark Zuckerberg is the youngest billionaire in history... but for this entrepreneur, success leads to both personal and legal complications. —Columbia Pictures",7.7,9.5,Biography,Drama,,,,,,"https://m.media-amazon.com/images/M/MV5BOGUyZDUxZjEtMmIzMC00MzlmLTg4MGItZWJmMzBhZjE0Mjc1XkEyXkFqcGdeQXVyMTMxODk2OTU@._V1_QL75_UX190_CR0,0,190,281_.jpg"
19,Inception,138,2011,Best Achievement in Cinematography,Best Achievement in Sound Mixing,Best Achievement in Sound Editing,Best Achievement in Visual Effects,,,,2010,2h 28min,"Dom Cobb is a skilled thief, the absolute best in the dangerous art of extraction, stealing valuable secrets from deep within the subconscious during the dream state, when the mind is at its most vulnerable. Cobb's rare ability has made him a coveted player in this treacherous new world of corporate espionage, but it has also made him an international fugitive and cost him everything he has ever loved. Now Cobb is being offered a chance at redemption. One last job could give him his life back but only if he can accomplish the impossible, inception. Instead of the perfect heist, Cobb and his team of specialists have to pull off the reverse: their task is not to steal an idea, but to plant one. If they succeed, it could be the perfect crime. But no amount of careful planning or expertise can prepare the team for the dangerous enemy that seems to predict their every move. An enemy that only Cobb could have seen coming. —Warner Bros. Pictures",8.8,7.4,Action,Adventure,Sci-Fi,Thriller,,,,"https://m.media-amazon.com/images/M/MV5BMjAxMzY3NjcxNF5BMl5BanBnXkFtZTcwNTI5OTM0Mw@@._V1_QL75_UX190_CR0,0,190,281_.jpg"
20,Alice in Wonderland,870,2011,Best Achievement in Art Direction,Best Achievement in Costume Design,,,,,,2010,1h 48min,"Alice, an unpretentious and individual 19-year-old, is betrothed to a dunce of an English nobleman. At her engagement party, she escapes the crowd to consider whether to go through with the marriage and falls down a hole in the garden after spotting an unusual rabbit. Arriving in a strange and surreal place called ""Underland,"" she finds herself in a world that resembles the nightmares she had as a child, filled with talking animals, villainous queens and knights, and frumious bandersnatches. Alice realizes that she is there for a reason--to conquer the horrific Jabberwocky and restore the rightful queen to her throne. —Jim Beaver <jumblejim@prodigy.net>",6.4,5.3,Adventure,Family,Fantasy,Mystery,,,,"https://m.media-amazon.com/images/M/MV5BMTMwNjAxMTc0Nl5BMl5BanBnXkFtZTcwODc3ODk5Mg@@._V1_QL75_UX190_CR0,0,190,281_.jpg"
21,Toy Story 3,2224,2011,"Best Achievement in Music Written for Motion Pictures, Original Song",Best Animated Feature Film of the Year,,,,,,2010,1h 43min,"Woody, Buzz and the whole gang are back. As their owner Andy prepares to depart for college, his loyal toys find themselves in daycare where untamed tots with their sticky little fingers do not play nice. So, it's all for one and one for all as they join Barbie's counterpart Ken, a thespian hedgehog named Mr. Pricklepants and a pink, strawberry-scented teddy bear called Lots-o'-Huggin' Bear to plan their great escape. —Walt Disney Studios",8.2,9.2,Animation,Adventure,Comedy,Family,Fantasy,,,"https://m.media-amazon.com/images/M/MV5BMTgxOTY4Mjc0MF5BMl5BanBnXkFtZTcwNTA4MDQyMw@@._V1_QL75_UY281_CR5,0,190,281_.jpg"
22,The Lost Thing,6,2011,"Best Short Film, Animated",,,,,,,2010,15min,"In a not-so-distant future, somewhere in Australia's sandy beaches, a young boy while collecting bottle tops for his collection, makes an amazing discovery: a humongous and strange, yet friendly creature. Unable to classify this being, the boy soon realises that, in reality, the poor creature is actually lost and it has nowhere to go. But how could someone fail to notice such a magnificent living organism, moreover, how can a little boy find where it belongs? —Nick Riganas",7.4,0,Animation,Short,Drama,Fantasy,Sci-Fi,,,"https://m.media-amazon.com/images/M/MV5BZDFhMWUxNzAtNjNhNi00MDM0LTljODItNjZjMTA3MjA2YzUwXkEyXkFqcGdeQXVyNDE5MTU2MDE@._V1_QL75_UY281_CR2,0,190,281_.jpg"
23,God of Love,7,2011,"Best Short Film, Live Action",,,,,,,2010,18min,"A lovestruck, lounge-singing darts champion finds his prayers are answered -- literally -- when he mysteriously receives a box of love-inducing darts.",7.6,0,Short,Comedy,Fantasy,Romance,,,,"https://m.media-amazon.com/images/M/MV5BMTQ4NDI3NDg4M15BMl5BanBnXkFtZTcwMjY5OTI1OA@@._V1_QL75_UX190_CR0,0,190,281_.jpg"
24,Strangers No More,8,2011,"Best Documentary, Short Subjects",,,,,,,2010,40min,"In the heart of Tel Aviv, there is an exceptional school where children from forty-eight different countries and diverse backgrounds come together to learn. Many of the students arrive at Bialik-Rogozin School fleeing poverty, political adversity and even genocide. Here, no child is a stranger. The film follows several students' struggle to acclimate to life in a new land while slowly opening up to share their stories of hardship and tragedy: Mohammed, a sixteen-year-old refugee from Darfur, witnessed the killing of his grandmother and father before escaping alone through Egypt to Israel. Having never been in a school before, his sharp mind and tremendous determination enable him to make up the years of study he never had. Johannes arrived at Bialik-Rogozin after spending most of his life in refugee camps across the Middle East. His father struggles to obtain a work visa while twelve-year-old Johannes struggles to adjust to attending school for the first time. After a slow start, his teachers realize that he is nearly blind in one eye and take him to an eye clinic. With his new glasses, before long, he is reading and writing - and helping other newcomers to adjust. After the murder of her mother, Esther and her father fled South Africa with nothing, in search of safety and peace of mind. At Bialik-Rogozin, they are welcomed with clothing, food and counsel on beginning a new life. Esther's teachers try to relieve the trauma of a nine-year-old girl who believes her mother will return. With tremendous effort and dedication, the school provides the support these children need to recover from their past. Together, the bond between teacher and student, and amongst the students themselves, enables them to create new lives in this exceptional community. Upon graduation, Mohammed provides the finest evidence of the school's ultimate success -- declaring his dream to return to Darfur and build a school for the children of the village he once fled. —SGPictures",7.3,0,Documentary,Short,,,,,,"https://m.media-amazon.com/images/M/MV5BN2YyZjQ0NTEtNzU5MS00NGZkLTg0MTEtYzJmMWY3MWRhZjM2XkEyXkFqcGdeQXVyMDA4NzMyOA@@._V1_QL75_UX190_CR0,0,190,281_.jpg"
25,Inside Job,3257,2011,"Best Documentary, Features",,,,,,,2010,1h 49min,"'Inside Job' provides a comprehensive analysis of the global financial crisis of 2008, which at a cost over $20 trillion, caused millions of people to lose their jobs and homes in the worst recession since the Great Depression, and nearly resulted in a global financial collapse. Through exhaustive research and extensive interviews with key financial insiders, politicians, journalists, and academics, the film traces the rise of a rogue industry which has corrupted politics, regulation, and academia. It was made on location in the United States, Iceland, England, France, Singapore, and China. —Anonymous",8.2,8.8,Documentary,Crime,,,,,,"https://m.media-amazon.com/images/M/MV5BMTQ3MjkyODA2Nl5BMl5BanBnXkFtZTcwNzQxMTU4Mw@@._V1_QL75_UX190_CR0,0,190,281_.jpg"
