id,movie_name,ranking,award_year,award_name1,award_name2,award_name3,award_name4,award_name5,award_name6,award_name7,release_year,running_time,storyline,user_rating,critic_rating,genre1,genre2,genre3,genre4,genre5,genre6,genre7,imgurl
106,Sinbihan Dongmulsajeon (Mysterious Animal Dictionary),779,2017,Best Achievement in Costume Design,,,,,,,2016,2h 12min,"In mid-1920s New York, Newt Scamander, a British young activist wizard, arrives in the city, holding a mysterious leather suitcase that shelters diverse and magical creatures that exist among us. Amid an already fragile equilibrium of secrecy, and the increasing disasters ascribed to the dark wizard, Gellert Grindelwald, Newt's precious suitcase goes missing, and to make matters worse, several creatures manage to escape. Before long, this unforeseen complication catches Senior Auror Percival Graves' attention who targets Newt, against the backdrop of an invisible, devastating, and utterly unpredictable menace that still wreaks havoc on 5th Avenue. In the end, is there a hidden agenda behind Graves' intentions? Moreover, what will happen to the remaining fantastic beasts that are still on the loose? —Nick Riganas",7.3,6.6,Adventure,Family,Fantasy,,,,,"https://m.media-amazon.com/images/M/MV5BMjMxOTM1OTI4MV5BMl5BanBnXkFtZTgwODE5OTYxMDI@._V1_QL75_UX190_CR0,0,190,281_.jpg"
107,Arrival,290,2017,Best Achievement in Sound Editing,,,,,,,2016,1h 56min,"Linguistics professor Louise Banks leads an elite team of investigators when gigantic spaceships touchdown in 12 locations around the world. As nations teeter on the verge of global war, Banks and her crew must race against time to find a way to communicate with the extraterrestrial visitors. Hoping to unravel the mystery, she takes a chance that could threaten her life and quite possibly all of mankind. —Jwelch5742",7.9,8.1,Drama,Sci-Fi,,,,,,"https://m.media-amazon.com/images/M/MV5BMTExMzU0ODcxNDheQTJeQWpwZ15BbWU4MDE1OTI4MzAy._V1_QL75_UX190_CR0,8,190,281_.jpg"
108,The Jungle Book,1921,2017,Best Achievement in Visual Effects,,,,,,,2016,1h 46min,"Living among the wolves in the jungle, young man cub Mowgli quickly learns to live life among his wolf pack and all the animals that inhabit the jungle, but when the villainous tiger Shere Khan threatens Mowgli's life, black panther Bagheera offers to take Mowgli to a nearby man village where he will be safe from the tiger's wrath. Along the way, Mowgli gets tangled up in a series of encounters with a sly snake named Kaa, a swimmingly ruthless gigantopithecus named King Louie and a lazy bear named Baloo, who quickly becomes his guide to the 'bear necessities' of life. —Blazer346",7.4,7.7,Adventure,Comedy,Drama,Family,Fantasy,,,"https://m.media-amazon.com/images/M/MV5BMTc3NTUzNTI4MV5BMl5BanBnXkFtZTgwNjU0NjU5NzE@._V1_QL75_UX190_CR0,0,190,281_.jpg"
109,Forushande,34,2017,Best Foreign Language Film of the Year,,,,,,,2016,2h 4min,"Forced to leave their collapsing house, Ranaa and Emad, an Iranian couple who happen to be performers rehearsing for Arthur Miller's ""Death of a Salesman"" rent a new apartment from one of their fellow performers. Unaware of the fact that the previous tenant had been a woman of ill repute having many clients, they settle down. By a nasty turn of events one of the clients pays a visit to the apartment one night while Ranaa is alone at home taking a bath and the aftermath turns the peaceful life of the couple upside down. —Hossein sr",7.7,8.5,Drama,,,,,,,"https://m.media-amazon.com/images/M/MV5BMTBkMjMyN2UtNzVjNi00Y2ZiLTk2MDYtN2Y0MjgzYjAxNzE4XkEyXkFqcGdeQXVyNjkxOTM4ODY@._V1_QL75_UY281_CR5,0,190,281_.jpg"
110,Jutopia,875,2017,Best Animated Feature Film of the Year,,,,,,,2016,1h 48min,"From the largest elephant to the smallest shrew, the city of Zootopia is a mammal metropolis where various animals live and thrive. When Judy Hopps becomes the first rabbit to join the police force, she quickly learns how tough it is to enforce the law. Determined to prove herself, Judy jumps at the opportunity to solve a mysterious case. Unfortunately, that means working with Nick Wilde, a wily fox who makes her job even harder. —Jwelch5742",8,7.8,Animation,Adventure,Comedy,Crime,Family,Mystery,,"https://m.media-amazon.com/images/M/MV5BOTMyMjEyNzIzMV5BMl5BanBnXkFtZTgwNzIyNjU0NzE@._V1_QL75_UX190_CR0,0,190,281_.jpg"
111,Suicide Squad,213,2017,Best Achievement in Makeup and Hairstyling,,,,,,,2016,2h 3min,"It feels good to be bad...Assemble a team of the world's most dangerous, incarcerated Super Villains, provide them with the most powerful arsenal at the government's disposal, and send them off on a mission to defeat an enigmatic, insuperable entity. U.S. intelligence officer Amanda Waller has determined only a secretly convened group of disparate, despicable individuals with next to nothing to lose will do. However, once they realize they weren't picked to succeed but chosen for their patent culpability when they inevitably fail, will the Suicide Squad resolve to die trying, or decide it's every man for himself? —ahmetkozan",5.9,4,Action,Adventure,Fantasy,Sci-Fi,,,,"https://m.media-amazon.com/images/M/MV5BMjM1OTMxNzUyM15BMl5BanBnXkFtZTgwNjYzMTIzOTE@._V1_QL75_UX190_CR0,0,190,281_.jpg"
112,O.J.: Made in America,2369,2017,Best Documentary Feature,,,,,,,2016,7h 47min,"It is the defining cultural tale of modern America - a saga of race, celebrity, media, violence, and the criminal justice system. And two decades after its unforgettable climax, it continues to fascinate, polarize, and even, yes, develop new chapters. Now, the producers of ESPN's award-winning ""30 for 30"" have made it the subject of their first documentary-event and most ambitious project yet. From Peabody and Emmy-award winning director Ezra Edelman, it's ""O.J.: Made in America,"" a 10-hour multi-part production coming summer of 2016. To most observers, it's a story that began the night Nicole Brown Simpson and Ronald Goldman were brutally murdered outside her Brentwood apartment. But as ""O.J."" lays bare, to truly grasp the significance of what happened not just that night, but the epic chronicle to follow, one has to travel back to a much different, much earlier origin point, at not the end, but the beginning of the 20th century, when African-Americans began migrating to California en masse, in desperate, collective hope of a better life, trying desperately - and fruitlessly - to outrun the racism that had defined their lives. And among the thousands who came west from the south were the grandparents of Orenthal James Simpson. The tale is familiar from there. In the mid-1960's, Simpson rose to instant fame as an unstoppable running back for the USC Trojans, and later, not just a record-setting Hall of Famer in the NFL, but a crossover, charismatic superstar with a singular foothold in the celebrity landscape. In retirement, O.J. remained as popular as any active athlete - a broadcaster, pitch-man, and actor. But he stood alone for another reason as well. Living in the shadows of everything from the Civil Rights Movement to the Rodney King riots and so much in between, in a country forever divided by racial lines and a city with a horrific legacy of institutionalized police racism, O.J. Simpson managed always to find a way to transcend the color of his skin. That is, until everything changed on that June night of 1994. ""O.J."" revisits - and redefines - it all. The domestic abuse. The police investigation. The white Bronco chase. The trial of the century. The motive, the blood, the glove. The verdict. The aftermath. Drawing upon more than seventy interviews- from longtime friends and colleagues of Simpson to the recognizable protagonists of the murder investigation to observers and commentators with distinct connections to the story - the docu-event is an engrossing, compelling, and unforgettable look at a tantalizing saga. Because at the end of what seems like a search for the real truth about O.J. Simpson, what's revealed just as powerfully is a collection of indelible, unshakeable, and haunting truths about America, and about ourselves. —ESPN Films",8.9,0,Documentary,Biography,Crime,History,,,,"https://m.media-amazon.com/images/M/MV5BODAzNDMxMzAxOV5BMl5BanBnXkFtZTgwMDMxMjA4MjE@._V1_QL75_UX190_CR0,0,190,281_.jpg"
113,The White Helmets,35,2017,Best Documentary Short Subject,,,,,,,2016,41min,"After five years of war, over 400,000 syrians have been killed and millions have fled their homes. In areas out of regime control, those who remain rely on a group of volunteers dedicated to saving anyone in need. They search for survivors among the wreckage as bombs continue to fall. —Cathy",7.5,0,Documentary,Short,War,,,,,"https://m.media-amazon.com/images/M/MV5BMzE4ZTQ3M2YtYjY4ZS00OWNhLWFkYjgtNWIyNzkyOWQ5MGE1XkEyXkFqcGdeQXVyMjMwNjUwMTc@._V1_QL75_UX190_CR0,0,190,281_.jpg"
114,Piper,36,2017,Best Animated Short Film,,,,,,,2016,6min,"A young and bright-eyed Sandpiper is motivated by her mother to start hunting for food along with the rest of the flock in the sandy seashore. However, the tiny bird is still terrorised by the surfs that break on the ocean's shoreline, unable to take care of herself. Poor little Piper, growing up is difficult, nevertheless, your caring mother believes in you. —Nick Riganas",8.4,0,Animation,Short,Family,,,,,"https://m.media-amazon.com/images/M/MV5BMjI5MDY1NjYzMl5BMl5BanBnXkFtZTgwNjIzNDAxNDM@._V1_QL75_UX190_CR0,0,190,281_.jpg"
115,Mindenki,37,2017,Best Live Action Short Film,,,,,,,2016,25min,"'Sing' is a childhood drama with a lot of music, set in 1990s Budapest, Hungary. Inspired by a true story, it follows an award winning school choir and the new girl in class who just might uncover the ugly secret behind their fame.",8,0,Short,Drama,Music,,,,,"https://m.media-amazon.com/images/M/MV5BMzgwODk3ODA1NF5BMl5BanBnXkFtZTcwNjU3NjQ0Nw@@._V1_QL75_UX190_CR0,0,190,281_.jpg"
116,The Shape of Water,843,2018,Best Motion Picture of the Year,Best Achievement in Directing,Best Achievement in Production Design,Best Achievement in Music Written for Motion Pictures (Original Score),,,,2017,2h 3min,"From master storyteller Guillermo del Toro comes THE SHAPE OF WATER, an otherworldly fable set against the backdrop of Cold War era America circa 1962. In the hidden high-security government laboratory where she works, lonely Elisa (Sally Hawkins) is trapped in a life of isolation. Elisa's life is changed forever when she and co-worker Zelda (Octavia Spencer) discover a secret classified experiment. Rounding out the cast are Michael Shannon, Richard Jenkins, Michael Stuhlbarg, and Doug Jones. —Fox Searchlight Pictures",7.3,8.7,Adventure,Drama,Fantasy,Romance,Sci-Fi,Thriller,,"https://m.media-amazon.com/images/M/MV5BNGNiNWQ5M2MtNGI0OC00MDA2LWI5NzEtMmZiYjVjMDEyOWYzXkEyXkFqcGdeQXVyMjM4NTM5NDY@._V1_QL75_UX190_CR0,0,190,281_.jpg"
117,Darkest Hour,754,2018,Best Performance by an Actor in a Leading Role,Best Achievement in Makeup and Hairstyling,,,,,,2017,2h 5min,"During World War II, as Adolf Hitler's powerful Wehrmacht rampages across Europe, the Prime Minister of the United Kingdom, Neville Chamberlain, is forced to resign, recommending Winston Churchill as his replacement. But even in his early days as the country's leader, Churchill is under pressure to commence peace negotiations with Hitler or to fight head-on the seemingly invincible Nazi regime, whatever the cost. However difficult and dangerous his decision may be, Churchill has no choice but to shine in the country's darkest hour. —Nick Riganas",7.4,7.5,Biography,Drama,History,War,,,,"https://m.media-amazon.com/images/M/MV5BNTU4MjMwOTgyMV5BMl5BanBnXkFtZTgwODQzNjY2NDM@._V1_QL75_UX190_CR0,0,190,281_.jpg"
118,"Three Billboards Outside Ebbing, Missouri",770,2018,Best Performance by an Actress in a Leading Role,Best Performance by an Actor in a Supporting Role,,,,,,2017,1h 55min,"THREE BILLBOARDS OUTSIDE EBBING, MISSOURI is a darkly comic drama from Academy Award nominee Martin McDonagh (In Bruges). After months have passed without a culprit in her daughter's murder case, Mildred Hayes (Academy Award winner Frances McDormand) makes a bold move, painting three signs leading into her town with a controversial message directed at William Willoughby (Academy Award nominee Woody Harrelson), the town's revered chief of police. When his second-in-command Officer Dixon (Academy Award winner Sam Rockwell), an immature mother's boy with a penchant for violence, gets involved, the battle between Mildred and Ebbing's law enforcement is only exacerbated. —Fox Searchlight Pictures",8.1,8.8,Comedy,Crime,Drama,,,,,"https://m.media-amazon.com/images/M/MV5BMjI0ODcxNzM1N15BMl5BanBnXkFtZTgwMzIwMTEwNDI@._V1_QL75_UX190_CR0,0,190,281_.jpg"
119,"I, Tonya",1651,2018,Best Performance by an Actress in a Supporting Role,,,,,,,2017,1h 59min,"From the proverbial wrong side of the tracks in Portland, Oregon, former competitive figure skater Tonya Harding was never fully accepted in the figure skating community for not inherently being the image of grace, breeding and privilege that the community wanted to portray, despite she being naturally gifted in the sport athletically. Despite ultimately garnering some success in figure skating being national champion, a world championship medalist, an Olympian, and being the first American woman to complete a Triple Axel in competition, she is arguably best known for her association to ""the incident"": the leg bashing on January 6, 1994 of her competitor, Nancy Kerrigan, who, unlike Tonya, was everything that the figure-skating community wanted in their representatives. Her association to that incident led to Tonya being banned from competitive figure skating for life. Tonya's story from the beginning of her figure-skating life at age four to the aftermath of the incident is presented. Besides Tonya herself, key people in her life give their perspective of their role in her life. Although they may agree on the broad issues at hand, such as that the incident did occur, they may vary widely in their recollection of the details. These people are: her waitress mother Lavona Golden, who despite having paid for her expensive figure-skating lessons, was abusive toward her physically and emotionally, never believing she being good enough in any aspect of the word, and who pulled her from school to focus solely on the figure skating; Diane Rawlinson, her first and longest serving coach, who, for good or bad, largely let Tonya be Tonya in the way she presented herself to the figure skating world; Jeff Gillooly, her first husband, the two who also had a turbulent relationship on a need to be loved perhaps without truly loving the other; Jeff's friend and Tonya's bodyguard Shawn Eckardt, a dim bulb who believed himself to be a bigger player in the big scheme of life than he actually was; and sports journalist Martin Maddox, a fictional character who provides general commentary of what the sports media as a collective wanted out of Tonya and the incident. —Huggo",7.5,7.7,Biography,Comedy,Drama,Sport,,,,"https://m.media-amazon.com/images/M/MV5BMjI5MDY1NjYzMl5BMl5BanBnXkFtZTgwNjIzNDAxNDM@._V1_QL75_UX190_CR0,0,190,281_.jpg"
120,Blade Runner 2049,75,2018,Best Achievement in Cinematography,Best Achievement in Visual Effects,,,,,,2017,2h 44min,"Thirty years after the events of Blade Runner (1982), a new Blade Runner, L.A.P.D. Officer ""K"" (Ryan Gosling), unearths a long-buried secret that has the potential to plunge what's left of society into chaos. K's discovery leads him on a quest to find Rick Deckard (Harrison Ford), a former L.A.P.D. Blade Runner, who has been missing for thirty years. —Warner Bros. Pictures",8,8.1,Action,Drama,Mystery,Sci-Fi,Thriller,,,"https://m.media-amazon.com/images/M/MV5BNzA1Njg4NzYxOV5BMl5BanBnXkFtZTgwODk5NjU3MzI@._V1_QL75_UX190_CR0,0,190,281_.jpg"
121,Dunkirk,472,2018,Best Achievement in Film Editing,Best Achievement in Sound Mixing,Best Achievement in Sound Editing,,,,,2017,1h 46min,"May/June 1940. Four hundred thousand British and French soldiers are hole up in the French port town of Dunkirk. The only way out is via sea, and the Germans have air superiority, bombing the British soldiers and ships without much opposition. The situation looks dire and, in desperation, Britain sends civilian boats in addition to its hard-pressed Navy to try to evacuate the beleaguered forces. This is that story, seen through the eyes of a soldier amongst those trapped forces, two Royal Air Force fighter pilots, and a group of civilians on their boat, part of the evacuation fleet. —grantss",7.8,9.4,Action,Drama,History,Thriller,War,,,"https://m.media-amazon.com/images/M/MV5BN2YyZjQ0NTEtNzU5MS00NGZkLTg0MTEtYzJmMWY3MWRhZjM2XkEyXkFqcGdeQXVyMDA4NzMyOA@@._V1_QL75_UX190_CR0,0,190,281_.jpg"
122,Phantom Thread,1258,2018,Best Achievement in Costume Design,,,,,,,2017,2h 10min,"Set in the glamour of 1950s post-war London, renowned dressmaker Reynolds Woodcock (Daniel Day-Lewis) and his sister Cyril (Lesley Manville) are at the center of British fashion, dressing royalty, movie stars, heiresses, socialites, debutants, and dames with the distinct style of The House of Woodcock. Women come and go through Woodcock's life, providing the confirmed bachelor with inspiration and companionship, until he comes across a young, strong-willed woman, Alma (Vicky Krieps), who soon becomes a fixture in his life as his muse and lover. Once controlled and planned, he finds his carefully tailored life disrupted by love. —Focus Features",7.5,9,Drama,Romance,,,,,,"https://m.media-amazon.com/images/M/MV5BMWJkNzBkM2UtYWFlMC00NmEwLTgxOGUtMjVmMzYyZjgyMmEzXkEyXkFqcGdeQXVyMjM4NTM5NDY@._V1_QL75_UY281_CR0,0,190,281_.jpg"
123,A Fantastic Woman,38,2018,Best Foreign Language Film of the Year,,,,,,,2017,1h 44min,,7.3,0,Drama,,,,,,,
124,Get Out,303,2018,Best Original Screenplay,,,,,,,2017,1h 44min,"Chris and his girlfriend Rose go upstate to visit her parents for the weekend. At first, Chris reads the family's overly accommodating behavior as nervous attempts to deal with their daughter's interracial relationship, but as the weekend progresses, a series of increasingly disturbing discoveries lead him to a truth that he never could have imagined. —Anonymous",7.7,8.5,Horror,Mystery,Thriller,,,,,"https://m.media-amazon.com/images/M/MV5BMjUxMDQwNjcyNl5BMl5BanBnXkFtZTgwNzcwMzc0MTI@._V1_QL75_UX190_CR0,0,190,281_.jpg"
125,Call Me by Your Name,302,2018,Best Adapted Screenplay,,,,,,,2017,2h 12min,"CALL ME BY YOUR NAME, the new film by Luca Guadagnino, is a sensual and transcendent tale of first love, based on the acclaimed novel by André Aciman. It's the summer of 1983 in the north of Italy, and Elio Perlman (Timothée Chalamet), a precocious 17-year-old young man, spends his days in his family's 17th-century villa transcribing and playing classical music, reading, and flirting with his friend Marzia (Esther Garrel). Elio enjoys a close relationship with his father (Michael Stuhlbarg), an eminent professor specializing in Greco-Roman culture, and his mother Annella (Amira Casar), a translator, who favor him with the fruits of high culture in a setting that overflows with natural delights. While Elio's sophistication and intellectual gifts suggest he is already a fully-fledged adult, there is much that yet remains innocent and unformed about him, particularly about matters of the heart. One day, Oliver (Armie Hammer), a 24-year-old American college graduate student working on his doctorate, arrives as the annual summer intern tasked with helping Elio's father. Amid the sun-drenched splendor of the setting, Elio and Oliver discover the heady beauty of awakening desire over the course of a summer that will alter their lives forever. —Sony Pictures Classics",7.9,9.3,Drama,Romance,,,,,,"https://m.media-amazon.com/images/M/MV5BNDk3NTEwNjc0MV5BMl5BanBnXkFtZTgwNzYxNTMwMzI@._V1_QL75_UX190_CR0,0,190,281_.jpg"
126,Coco,507,2018,Best Achievement in Music Written for Motion Pictures (Original Song),Best Animated Feature Film,,,,,,2017,1h 45min,"Despite his family's baffling generations-old ban on music, Miguel dreams of becoming an accomplished musician like his idol, Ernesto de la Cruz. Desperate to prove his talent, Miguel finds himself in the stunning and colorful Land of the Dead following a mysterious chain of events. Along the way, he meets charming trickster Hector, and together, they set off on an extraordinary journey to unlock the real story behind Miguel's family history. —Disney/Pixar",8.4,8.1,Animation,Adventure,Comedy,Family,Fantasy,Music,Mystery,"https://m.media-amazon.com/images/M/MV5BYjQ5NjM0Y2YtNjZkNC00ZDhkLWJjMWItN2QyNzFkMDE3ZjAxXkEyXkFqcGdeQXVyODIxMzk5NjA@._V1_QL75_UY281_CR4,0,190,281_.jpg"
127,Icarus,39,2018,Best Documentary Feature,,,,,,,2017,2h,"When Bryan Fogel sets out to uncover the truth about doping in sports, a chance meeting with a Russian scientist transforms his story from a personal experiment into a geopolitical thriller involving dirty urine, unexplained death and Olympic Gold-exposing the biggest scandal in sports history.",7.9,6.8,Documentary,Sport,,,,,,"https://m.media-amazon.com/images/M/MV5BY2QyZWZjY2UtMTJjZS00YmFlLWJmM2QtZTczODc5MTFkYjQyXkEyXkFqcGdeQXVyNTAyODkwOQ@@._V1_QL75_UX190_CR0,0,190,281_.jpg"
128,Heaven Is a Traffic Jam on the 405,40,2018,Best Documentary Short Subject,,,,,,,2016,40min,"Mindy Alper is a tortured and brilliant 56 year old artist who is represented by one of Los Angeles' top galleries. Acute anxiety, mental disorder and devastating depression have caused her to be committed to mental institutions undergo electro shock therapy and survive a 10 year period without the ability to speak. Her hyper self awareness has allowed her to produce a lifelong body of work that expresses her emotional state with powerful psychological precision. Through interviews, reenactments, the building of an eight and a half foot papier-mache' bust of her beloved psychiatrist, and examining drawings made from the time she was a child, we learn how she has emerged from darkness and isolation to a life that includes love, trust and support. —Frank Stiefel",7.4,0,Documentary,Short,Biography,,,,,"https://m.media-amazon.com/images/M/MV5BOTA5NDZlZGUtMjAxOS00YTRkLTkwYmMtYWQ0NWEwZDZiNjEzXkEyXkFqcGdeQXVyMTMxODk2OTU@._V1_QL75_UX190_CR0,0,190,281_.jpg"
129,Dear Basketball,41,2018,Best Animated Short Film,,,,,,,2017,6min,"On November 29, 2015 Kobe Bryant penned a letter in the Players' Tribune announcing his retirement from basketball at the end of that season. This film is the visualization of that letter, narrated by Kobe, scored by John Williams and animated by Glen Keane. —kbvsmj23",7.4,0,Animation,Short,Biography,Sport,,,,"https://m.media-amazon.com/images/M/MV5BOWExOTc5MmEtOGE0OC00ODVmLWExOWEtNDQzM2NiZDViYWI0XkEyXkFqcGdeQXVyODMzMDE2MjY@._V1_QL75_UX190_CR0,0,190,281_.jpg"
130,The Silent Child,42,2018,Best Live Action Short Film,,,,,,,2017,20min,Set in rural England and inspired by real life events. The Silent Child centres around a profoundly deaf four year old girl named Libby who is born into a middle class family and lives in a world of silence until a caring social worker teaches her the gift of communication.,7.7,0,Short,Drama,,,,,,"https://m.media-amazon.com/images/M/MV5BMWZiNjE2OWItMTkwNy00ZWQzLWI0NTgtMWE0NjNiYTljN2Q1XkEyXkFqcGdeQXVyNzAwMjYxMzA@._V1_QL75_UX190_CR0,0,190,281_.jpg"
131,Carne y Arena,43,2018,None,,,,,,,2017,7min,"Based on true accounts, the superficial lines between subject and bystander are blurred and bound together, allowing individuals to walk in a vast space and thoroughly live a fragment of the refugees' personal journeys.",8.4,0,Short,Drama,,,,,,"https://m.media-amazon.com/images/M/MV5BNjE5MzYwMzYxMF5BMl5BanBnXkFtZTcwOTk4MTk0OQ@@._V1_QL75_UY281_CR0,0,190,281_.jpg"
132,Green Book,533,2019,Best Motion Picture of the Year,Best Performance by an Actor in a Supporting Role,Best Original Screenplay,,,,,2018,2h 10min,"In 1962, Tony ""Tony Lip"" Vallelonga, a tough bouncer, is looking for work when his nightclub is closed for renovations. The most promising offer turns out to be the driver for the African-American classical pianist Don Shirley for a concert tour into the Deep South states. Although hardly enthused at working for a black man, Tony accepts the job and they begin their trek armed with The Negro Motorist Green Book, a travel guide for safe travel through America's racial segregation. Together, the snobbishly erudite pianist and the crudely practical bouncer can barely get along with their clashing attitudes to life and ideals. However, as the disparate pair witness and endure America's appalling injustices on the road, they find a newfound respect for each other's talents and start to face them together. In doing so, they would nurture a friendship and understanding that would change both their lives. —Kenneth Chisholm (kchishol@rogers.com)",8.2,6.9,Biography,Comedy,Drama,Music,,,,"https://m.media-amazon.com/images/M/MV5BYzIzYmJlYTYtNGNiYy00N2EwLTk4ZjItMGYyZTJiOTVkM2RlXkEyXkFqcGdeQXVyODY1NDk1NjE@._V1_QL75_UX190_CR0,2,190,281_.jpg"
