id,movie_name,ranking,award_year,award_name1,award_name2,award_name3,award_name4,award_name5,award_name6,award_name7,release_year,running_time,storyline,user_rating,critic_rating,genre1,genre2,genre3,genre4,genre5,genre6,genre7,imgurl
52,Curfew,18,2013,"Best Short Film, Live Action",,,,,,,2012,19min,"Sadly, having reached the lowest point in his life and on the brink of demise, the self-destructive outcast, Richie, desperately wants out. However, as nothing is over yet, an unexpected call from his estranged sister, Maggie, offers a new lease of life, even though it is only a fleeting one. Strange as it may seem--as Richie is the last person she would ever call--a distraught Maggie needs Richie, of all the people, to look after her young daughter, Sophia, for the night. However, as the two alienated relatives timidly reconnect under New York's silvery night lights, much to their surprise, a subtle and delicate relationship will start to bloom. Could this be the beginning of a new reality? —Nick Riganas",7.9,0,Short,Drama,,,,,,"https://m.media-amazon.com/images/M/MV5BZTg5NWI3YjMtOGM3Mi00ZWFkLWE1YmQtOWUzYjFhZGQwYjVhXkEyXkFqcGdeQXVyNDE5MTU2MDE@._V1_QL75_UY281_CR11,0,190,281_.jpg"
53,Inocente,19,2013,"Best Documentary, Short Subjects",,,,,,,2012,40min,"A personal and vibrant coming of age story about a young artist's determination never to surrender to the bleakness of her surroundings. At 15, Inocente refuses to let her dream of becoming an artist be caged by being an undocumented immigrant forced to live homeless for the last nine years. Color is her personal revolution and its sweep on her canvases creates a world that looks nothing like her own dark past. 'Inocente' is both a timeless story about the transformative power of art and a timely snapshot of the new face of homelessness in America: children. The challenges are staggering, but the hope in her story proves that the hand she has been dealt does not define her, her dreams do. —Anonymous",7.3,0,Documentary,Short,Biography,Drama,News,,,"https://m.media-amazon.com/images/M/MV5BNWEzOTNjNDgtZDhhYS00ODAxLWIzNGMtYjU3OGZhYmI3ZDU4XkEyXkFqcGdeQXVyMTAzNjk5MDI4._V1_QL75_UY281_CR2,0,190,281_.jpg"
54,Searching for Sugar Man,20,2013,"Best Documentary, Features",,,,,,,2012,1h 26min,"In the early 1970s, Sixto Rodriguez was a Detroit folksinger who had a short-lived recording career with only two well received but non-selling albums. Unknown to Rodriguez, his musical story continued in South Africa where he became a pop music icon and inspiration for generations. Long rumored there to be dead by suicide, a few fans in the 1990s decided to seek out the truth of their hero's fate. What follows is a bizarrely heartening story in which they found far more in their quest than they ever hoped, while a Detroit construction laborer discovered that his lost artistic dreams came true after all. —Kenneth Chisholm (kchishol@rogers.com)",8.2,7.9,Documentary,Biography,Music,,,,,"https://m.media-amazon.com/images/M/MV5BMWYyMzgxNDQtMDI2Mi00NmMzLWI5MTAtMmUwNDg3Yjg3N2U3XkEyXkFqcGdeQXVyNzI1NzMxNzM@._V1_QL75_UY281_CR8,0,190,281_.jpg"
55,Amour,4934,2013,Best Foreign Language Film of the Year,,,,,,,2012,2h 7min,"Georges and Anne are a couple of retired music teachers enjoying life in their eighties. However, Anne suddenly has a stroke at breakfast and their lives are never the same. That incident begins Anne's harrowingly steep physical and mental decline as Georges attempts to care for her at home as she wishes. Even as the fruits of their lives and career remain bright, the couple's hopes for some dignity prove a dispiriting struggle even as their daughter enters the conflict. In the end, George, with his love fighting against his own weariness and diminished future on top of Anne's, is driven to make some critical decisions for them both. —Kenneth Chisholm (kchishol@rogers.com)",7.9,9.4,Drama,,,,,,,"https://m.media-amazon.com/images/M/MV5BMTk1NTc3NDc4MF5BMl5BanBnXkFtZTcwNjYwNDk0OA@@._V1_QL75_UX190_CR0,0,190,281_.jpg"
56,Merida and the Magical Forest,1996,2013,Best Animated Feature,,,,,,,2012,1h 33min,"Set in Scotland in a rugged and mythical time, this movie features Princess Merida (Kelly Macdonald), an aspiring archer and impetuous daughter of Queen Elinor (Dame Emma Thompson). Merida makes a reckless choice that unleashes unintended peril and forces her to spring into action to set things right. —Walt Disney Pictures",7.1,6.9,Animation,Adventure,Comedy,Family,Fantasy,,,"https://m.media-amazon.com/images/M/MV5BMzgwODk3ODA1NF5BMl5BanBnXkFtZTcwNjU3NjQ0Nw@@._V1_QL75_UX190_CR0,0,190,281_.jpg"
57,12 Years a Slave,1101,2014,Best Motion Picture of the Year,Best Performance by an Actress in a Supporting Role,"Best Writing, Adapted Screenplay",,,,,2013,2h 14min,"Based on an incredible true story of one man's fight for survival and freedom. In the pre-Civil War United States, Solomon Northup, a free black man from upstate New York, is abducted and sold into slavery. Facing cruelty personified by a malevolent slave owner, as well as unexpected kindnesses, Solomon struggles not only to stay alive, but to retain his dignity. In the twelfth year of his unforgettable odyssey, Solomon's chance meeting with a Canadian abolitionist will forever alter his life. —Fox Searchlight",8.1,9.6,Biography,Drama,History,,,,,"https://m.media-amazon.com/images/M/MV5BMjExMTEzODkyN15BMl5BanBnXkFtZTcwNTU4NTc4OQ@@._V1_QL75_UX190_CR0,0,190,281_.jpg"
58,Dallas Buyers Club,1139,2014,Best Performance by an Actor in a Leading Role,Best Performance by an Actor in a Supporting Role,Best Achievement in Makeup and Hairstyling,,,,,2013,1h 57min,"Dallas 1985. Electrician and sometimes rodeo bull rider Ron Woodroof lives hard, which includes heavy smoking, drinking, drug use (primarily cocaine) and casual sex. He is racist and homophobic. While in the hospital on a work related injury, the doctors discover and inform him that he is HIV+, and that he will most-likely die within thirty days. Ron is initially in angry denial that he would have a disease that only ""faggots"" have, but upon quick reflection comes to the realization that the diagnosis is probably true. He begins to read whatever research is available about the disease, which at this time seems to be most effectively treated by the drug AZT. AZT, however, is only in the clinical trials stage within the US. Incredulous that he, as a dying man, cannot pay for any drug which may save or at least prolong his life, he goes searching for it by whatever means possible. It eventually leads him to Mexico and a ""Dr."" Vass, an American physician whose license was revoked in the US because of his AIDS related work against US regulations. Dr. Vass leads Ron to a cocktail of other drugs, some vitamins, he believes are more effective in treating the symptoms, since the virus, as Ron learns, will always be in the system of those who have been exposed to it. Ron begins to smuggle these drugs not approved by the FDA into the US, not only for his own use but for sale to other HIV+ persons. In this venture, he goes into an unlikely partnership with a HIV+ transgender woman named Rayon, who he met in the hospital and who has greater contact with AIDS patients through the gay community. As they try to work both above ground to get the meds to those that need them and underground to avoid detection by especially the FDA, Ron comes up with an idea to circumvent the fact of selling the drugs - which are not considered drugs yet since they are not FDA approved - directly to the HIV+ population, which then should should not be against the law. Richard Barkley and Dr. Sevard, the FDA's lead man on the file and one of Ron's doctors respectively, the latter who sees clinical trials as the only way to determine the efficacy of drugs despite the fact that Ron and others would have probably died already without these drugs, try to stop Ron and Rayon at every turn. Caught in the middle is Dr. Eve Saks, another of Ron's doctors, who understands why policies are in place, but who can sympathize with Ron, Rayon and others - all her patients, directly or indirectly - in their situation. —Huggo",8,7.9,Biography,Drama,,,,,,"https://m.media-amazon.com/images/M/MV5BMTYwMTA4MzgyNF5BMl5BanBnXkFtZTgwMjEyMjE0MDE@._V1_QL75_UX190_CR0,0,190,281_.jpg"
59,Blue Jasmine,3865,2014,Best Performance by an Actress in a Leading Role,,,,,,,2013,1h 38min,"Jasmine French used to be on the top of the heap as a New York socialite, but now is returning to her estranged sister in San Francisco utterly ruined. As Jasmine struggles with her haunting memories of a privileged past bearing dark realities she ignored, she tries to recover in her present. Unfortunately, it all proves a losing battle as Jasmine's narcissistic hangups and their consequences begin to overwhelm her. In doing so, her old pretensions and new deceits begin to foul up everyone's lives, especially her own. —Kenneth Chisholm (kchishol@rogers.com)",7.3,7.8,Comedy,Drama,,,,,,"https://m.media-amazon.com/images/M/MV5BMTc0ODk5MzEyMV5BMl5BanBnXkFtZTcwMzI0MDY1OQ@@._V1_QL75_UX190_CR0,0,190,281_.jpg"
60,Gravity,1199,2014,Best Achievement in Directing,Best Achievement in Cinematography,Best Achievement in Film Editing,"Best Achievement in Music Written for Motion Pictures, Original Score",Best Achievement in Sound Mixing,Best Achievement in Sound Editing,Best Achievement in Visual Effects,2013,1h 31min,"Dr. Ryan Stone (Sandra Bullock) is a brilliant medical engineer on her first shuttle mission, with veteran astronaut Matt Kowalski (George Clooney) in command of his last flight before retiring. But on a seemingly routine spacewalk, disaster strikes. The shuttle is destroyed, leaving Stone and Kowalsky completely alone - tethered to nothing but each other and spiraling out into the blackness. —MuTaTeD",7.7,9.6,Adventure,Drama,Sci-Fi,Thriller,,,,"https://m.media-amazon.com/images/M/MV5BNjE5MzYwMzYxMF5BMl5BanBnXkFtZTcwOTk4MTk0OQ@@._V1_QL75_UY281_CR0,0,190,281_.jpg"
61,Geu-nyeo,717,2014,"Best Writing, Original Screenplay",,,,,,,2013,2h 6min,"Theodore is a lonely man in the final stages of his divorce. When he's not working as a letter writer, his down time is spent playing video games and occasionally hanging out with friends. He decides to purchase the new OS1, which is advertised as the world's first artificially intelligent operating system, ""It's not just an operating system, it's a consciousness,"" the ad states. Theodore quickly finds himself drawn in with Samantha, the voice behind his OS1. As they start spending time together they grow closer and closer and eventually find themselves in love. Having fallen in love with his OS, Theodore finds himself dealing with feelings of both great joy and doubt. As an OS, Samantha has powerful intelligence that she uses to help Theodore in ways others hadn't, but how does she help him deal with his inner conflict of being in love with an OS? —Bob Philpot",8,9.1,Drama,Romance,Sci-Fi,,,,,"https://m.media-amazon.com/images/M/MV5BMjA1Nzk0OTM2OF5BMl5BanBnXkFtZTgwNjU2NjEwMDE@._V1_QL75_UX190_CR0,0,190,281_.jpg"
62,The Great Gatsby,365,2014,Best Achievement in Costume Design,Best Achievement in Production Design,,,,,,2013,2h 23min,"An adaptation of F. Scott Fitzgerald's Long Island-set novel, where Midwesterner Nick Carraway is lured into the lavish world of his neighbor, Jay Gatsby. Soon enough, however, Carraway will see through the cracks of Gatsby's nouveau riche existence, where obsession, madness, and tragedy await. —Anonymous",7.2,5.5,Drama,Romance,,,,,,"https://m.media-amazon.com/images/M/MV5BMTkxNTk1ODcxNl5BMl5BanBnXkFtZTcwMDI1OTMzOQ@@._V1_QL75_UX190_CR0,2,190,281_.jpg"
63,Gyeowool Wangguk,812,2014,"Best Achievement in Music Written for Motion Pictures, Original Song",Best Animated Feature Film of the Year,,,,,,2013,1h 42min,"Fearless optimist Anna teams up with rugged mountain man Kristoff and his loyal reindeer Sven and sets off on an epic journey to find her sister Elsa, whose icy powers have trapped the kingdom of Arendelle in eternal winter. Encountering Everest-like conditions, mystical trolls and a hilarious snowman named Olaf, Anna and Kristoff battle the elements in a race to save the kingdom. From the outside Elsa looks poised, regal and reserved, but in reality she lives in fear as she wrestles with a mighty secret: she was born with the power to create ice and snow. It's a beautiful ability, but also extremely dangerous. Haunted by the moment her magic nearly killed her younger sister Anna, Elsa has isolated herself, spending every waking minute trying to suppress her growing powers. Her mounting emotions trigger the magic, accidentally setting off an eternal winter that she can't stop. She fears she's becoming a monster and that no one, not even her sister, can help her. —DeAlan Wilson for ComedyE.com",7.4,7.5,Animation,Adventure,Comedy,Family,Fantasy,Musical,,"https://m.media-amazon.com/images/M/MV5BMTQ1MjQwMTE5OF5BMl5BanBnXkFtZTgwNjk3MTcyMDE@._V1_QL75_UX190_CR0,0,190,281_.jpg"
64,Mr Hublot,21,2014,"Best Short Film, Animated",,,,,,,2013,11min,"OCD sufferer Mr Hublot lives in a frightening, fully automated world from which he hides, working from home. One day he spies an abandoned robot dog about to be crushed with the garbage and rescues it. The dog makes Mr Hublot very happy but it grows to an enormous size, forcing Mr Hublot to embrace a welcoming change as they move to larger premises. —don @ minifie-1",7.2,0,Animation,Short,Comedy,Family,Fantasy,,,"https://m.media-amazon.com/images/M/MV5BMTY1NjM0MzgxMV5BMl5BanBnXkFtZTgwNDc4NTY0NjM@._V1_QL75_UX190_CR0,8,190,281_.jpg"
65,Helium,22,2014,"Best Short Film, Live Action",,,,,,,2013,23min,"The boy Alfred is hospitalized and dying, but through the stories about Helium - a magical fantasy world where people go when the need 'the deep sleep' - told by the hospital's eccentric janitor, Enzo, Alfred regains the joy and happiness of his life and finds a safe haven away from daily life. —Anonymous",7.3,0,Short,Drama,Family,,,,,"https://m.media-amazon.com/images/M/MV5BMTA2NDc3Njg5NDVeQTJeQWpwZ15BbWU4MDc1NDcxNTUz._V1_QL75_UX190_CR0,0,190,281_.jpg"
66,The Lady in Number 6: Music Saved My Life,100,2014,"Best Documentary, Short Subjects",,,,,,,2013,39min,"The Lady In Number 6 is one of the most inspirational and uplifting stories of the year. 109 year old, Aliza Sommer-Herz, the world's oldest pianist and Holocaust survivor shares her story on how to achieve a long and happy life. She discussed the importance of music, laughter and how to have an optimistic outlook on life. —Jwelch5742",8,0,Documentary,Short,Biography,Drama,Music,,,"https://m.media-amazon.com/images/M/MV5BNjcyYjg0M2ItMzMyZS00NmM1LTlhZDMtN2MxN2RhNWY4YTkwXkEyXkFqcGdeQXVyNjY1MTg4Mzc@._V1_QL75_UX190_CR0,0,190,281_.jpg"
67,Twenty Feet from Stardom,23,2014,"Best Documentary, Features",,,,,,,2013,1h 31min,"The backup singer exists in a strange place in the pop music world; they are always in the shadow of the feature artists even when they are in front of them in concert while they provide a vital foundation for the music. Through interviews with veterans and concert footage, the history of these predominately African-American singers is explored through the rock era. Furthermore, special focus is given to special stand outs who endeavored to make a living in the art burdened with a low profile and more personal career frustrations, especially those who faced the very different challenge of singing in the spotlight themselves. —Kenneth Chisholm (kchishol@rogers.com)",7.4,8.3,Documentary,Biography,History,Music,,,,"https://m.media-amazon.com/images/M/MV5BMTQxNDY2NjMwNF5BMl5BanBnXkFtZTcwNzExMDg0OQ@@._V1_QL75_UX190_CR0,0,190,281_.jpg"
68,La grande bellezza,3379,2014,Best Foreign Language Film of the Year,,,,,,,2013,2h 21min,"Journalist Jep Gambardella has charmed and seduced his way through the lavish nightlife of Rome for decades. Since the legendary success of his one and only novel, he has been a permanent fixture in the city's literary and social circles, but when his 65th birthday coincides with a shock from the past, Jep finds himself unexpectedly taking stock of his life, turning his cutting wit on himself and his contemporaries, and looking past the extravagant nightclubs, parties, and cafés to find Rome in all its glory: a timeless landscape of absurd, exquisite beauty. —Jon Mulvaney",7.8,8.6,Drama,,,,,,,"https://m.media-amazon.com/images/M/MV5BMWU5NmE2ZTUtYzhkMi00N2JmLWJhODgtM2NhNWU5ZWE5MTRlXkEyXkFqcGdeQXVyNDE5MTU2MDE@._V1_QL75_UY281_CR2,0,190,281_.jpg"
69,Birdman or (The Unexpected Virtue of Ignorance),1150,2015,Best Motion Picture of the Year,Best Achievement in Directing,"Best Writing, Original Screenplay",Best Achievement in Cinematography,,,,2014,1h 59min,"Actor Riggan Thomson is most famous for his movie role from over twenty years ago of the comic book superhero Birdman in the blockbuster movie of the same name and its two equally popular sequels. His association with the role took over his life, where Birdman is more renowned than ""Riggan Thomson"" the actor. Now past middle age, Riggan is trying to establish himself as a true artist by writing, directing, starring in and co-producing with his best friend Jake what is his Broadway debut, an adaptation of Raymond Carver's story, What We Talk About When We Talk About Love. He is staking his name, what little artistic reputation that comes with that name and his life savings on the project, and as such will do anything needed to make the play a success. As he and Jake go through the process of the previews toward opening night, Riggan runs into several issues: needing to find a replacement for the integral supporting male role the night before the first preview; hiring the talented Broadway name, Mike Shiner, for that role, Mike who ends up being difficult to work with and who may end up overshadowing Riggan in the play; having to deal potentially with a lawsuit based on one of his actions to ensure success; needing to be there for his daughter, Sam, who he has hired to be his production assistant and who has just come out of drug rehab; and pleasing the New York Times critic, Tabitha Dickinson, who wants to use any excuse to give the play a scathing review which in turn would close the show after the opening night performance. But Riggan's biggest problem may be his own insecurities, which are manifested by him constantly hearing what he believes to be the truth from the voice of his Birdman character, who he often battles both internally and externally. —Huggo",7.7,8.7,Comedy,Drama,,,,,,"https://m.media-amazon.com/images/M/MV5BODAzNDMxMzAxOV5BMl5BanBnXkFtZTgwMDMxMjA4MjE@._V1_QL75_UX190_CR0,0,190,281_.jpg"
70,The Theory of Everything,1810,2015,Best Performance by an Actor in a Leading Role,,,,,,,2014,2h 3min,"The Theory of Everything is the story of the most brilliant and celebrated physicist of our time, Stephen Hawking, and Jane Wilde, the arts student he fell in love with while studying at Cambridge in the 1960s. Little was expected from Hawking, a bright but shiftless student of cosmology, after he was given just two years to live following the diagnosis of a fatal illness (ALS) at 21 years of age. He became galvanized, however, by the love Jane Wilde, and went on to be called the ""successor to Einstein,"" as well as a husband and father to their three children. Over the course of their marriage, however, as Stephen's body collapsed and his academic renown soared, fault lines were exposed that tested the resolve of their relationship and dramatically altered the course of both of their lives. —The Times",7.7,7.1,Biography,Drama,Romance,,,,,"https://m.media-amazon.com/images/M/MV5BMTAwMTU4MDA3NDNeQTJeQWpwZ15BbWU4MDk4NTMxNTIx._V1_QL75_UX190_CR0,0,190,281_.jpg"
71,Still Alice,24,2015,Best Performance by an Actress in a Leading Role,,,,,,,2014,1h 41min,"Alice Howland is a renowned linguistics professor happily married with three grown children. All that begins to change when she strangely starts to forget words and then more. When her doctor diagnoses her with Early-onset Alzheimer's Disease, Alice and her family's lives face a harrowing challenge as this terminal degenerative neurological ailment slowly progresses to an inevitable conclusion they all dread. Along the way, Alice struggles to not only to fight the inner decay, but to make the most of her remaining time to find the love and peace to make simply living worthwhile. —Kenneth Chisholm (kchishol@rogers.com)",7.5,7.2,Drama,,,,,,,"https://m.media-amazon.com/images/M/MV5BMjIzNzAxNjY1Nl5BMl5BanBnXkFtZTgwMDg4ODQxMzE@._V1_QL75_UX190_CR0,0,190,281_.jpg"
72,Whiplash,355,2015,Best Performance by an Actor in a Supporting Role,Best Achievement in Film Editing,Best Achievement in Sound Mixing,,,,,2014,1h 46min,"Nineteen year old Andrew Niemann wants to be the greatest jazz drummer in the world, in a league with Buddy Rich. This goal is despite not coming from a pedigree of greatest, musical or otherwise, with Jim, his high school teacher father, being a failed writer. Andrew is starting his first year at Shaffer Conservatory of Music, the best music school in the United States. At Shaffer, being the best means being accepted to study under Terence Fletcher and being asked to play in his studio band, which represents the school at jazz competitions. Based on their less than positive first meeting, Andrew is surprised that Fletcher asks him to join the band, albeit in the alternate drummer position which he is more than happy to do initially. Andrew quickly learns that Fletcher operates on fear and intimidation, never settling for what he considers less than the best each and every time. Being the best in Fletcher's mind does not only entail playing well, but knowing that you're playing well and if not what you're doing wrong. His modus operandi creates an atmosphere of fear and of every man or woman for him/herself within the band. Regardless, Andrew works hard to be the best. He has to figure out his life priorities and what he is willing to sacrifice to be the best. The other question becomes how much emotional abuse he will endure by Fletcher to reach that greatness, which he may believe he can only achieve with the avenues opened up by Fletcher. —Huggo",8.5,8.8,Drama,Music,,,,,,"https://m.media-amazon.com/images/M/MV5BOTA5NDZlZGUtMjAxOS00YTRkLTkwYmMtYWQ0NWEwZDZiNjEzXkEyXkFqcGdeQXVyMTMxODk2OTU@._V1_QL75_UX190_CR0,0,190,281_.jpg"
73,Boyhood,2253,2015,Best Performance by an Actress in a Supporting Role,,,,,,,2014,2h 45min,"Filmed over 12 years with the same cast, Richard Linklater's BOYHOOD is a groundbreaking story of growing up as seen through the eyes of a child named Mason (a breakthrough performance by Ellar Coltrane), who literally grows up on screen before our eyes. Starring Ethan Hawke and Patricia Arquette as Mason's parents and newcomer Lorelei Linklater as his sister Samantha, BOYHOOD charts the rocky terrain of childhood like no other film has before. Snapshots of adolescence from road trips and family dinners to birthdays and graduations and all the moments in between become transcendent, set to a soundtrack spanning the years from Coldplay's Yellow to Arcade Fire's Deep Blue. BOYHOOD is both a nostalgic time capsule of the recent past and an ode to growing up and parenting. —IFC Films",7.9,10,Drama,,,,,,,"https://m.media-amazon.com/images/M/MV5BMTYzNDc2MDc0N15BMl5BanBnXkFtZTgwOTcwMDQ5MTE@._V1_QL75_UX190_CR0,0,190,281_.jpg"
74,The Imitation Game,803,2015,"Best Writing, Adapted Screenplay",,,,,,,2014,1h 54min,"It is based on the real life story of legendary cryptanalyst Alan Turing, the film portrays the nail-biting race against time by Turing and his brilliant team of code-breakers at Britain's top-secret Government Code and Cypher School at Bletchley Park, during the darkest days of World War II. —Studio Canal",8,7.1,Biography,Drama,Thriller,War,,,,"https://m.media-amazon.com/images/M/MV5BOTgwMzFiMWYtZDhlNS00ODNkLWJiODAtZDVhNzgyNzJhYjQ4L2ltYWdlXkEyXkFqcGdeQXVyNzEzOTYxNTQ@._V1_QL75_UX190_CR0,1,190,281_.jpg"
75,The Grand Budapest Hotel,314,2015,Best Achievement in Costume Design,"Best Achievement in Music Written for Motion Pictures, Original Score",Best Achievement in Production Design,Best Achievement in Makeup and Hairstyling,,,,2014,1h 39min,"This movie recounts the adventures of M. Gustave (Ralph Fiennes), a legendary concierge at a famous European hotel between the wars, and Zero Moustafa (Tony Revolori), the lobby boy who becomes his most trusted friend. The story involves the theft and recovery of a priceless Renaissance painting and the battle for an enormous family fortune - all against the backdrop of a suddenly and dramatically changing continent. —Fox Searchlight Pictures",8.1,8.8,Adventure,Comedy,Crime,,,,,"https://m.media-amazon.com/images/M/MV5BMzM5NjUxOTEyMl5BMl5BanBnXkFtZTgwNjEyMDM0MDE@._V1_QL75_UX190_CR0,0,190,281_.jpg"
76,Selma,3484,2015,"Best Achievement in Music Written for Motion Pictures, Original Song",,,,,,,2014,2h 8min,"The unforgettable true story chronicles the tumultuous three-month period in 1965, when Dr. Martin Luther King, Jr. led a dangerous campaign to secure equal voting rights in the face of violent opposition. The epic march from Selma to Montgomery culminated in President Johnson signing the Voting Rights Act of 1965, one of the most significant victories for the civil rights movement. Director Ava DuVernay's ""Selma"" tells the story of how the revered leader and visionary Dr. Martin Luther King, Jr and his brothers and sisters in the movement prompted change that forever altered history. —Miss W J Mcdermott",7.5,8,Biography,Drama,History,,,,,"https://m.media-amazon.com/images/M/MV5BZGZkNzFkYTgtYTBkZC00M2MzLWJhNzUtMGE4YzRhYmU2Zjg0XkEyXkFqcGdeQXVyMTQxNzMzNDI@._V1_QL75_UX190_CR0,0,190,281_.jpg"
