id,movie_name,ranking,award_year,award_name1,award_name2,award_name3,award_name4,award_name5,award_name6,award_name7,release_year,running_time,storyline,user_rating,critic_rating,genre1,genre2,genre3,genre4,genre5,genre6,genre7,imgurl
77,American Sniper,1303,2015,Best Achievement in Sound Editing,,,,,,,2014,2h 13min,"Chris Kyle (Bradley Cooper) was nothing more than a Texas man who dreamt of becoming a cowboy, but in his thirties he found out that maybe his life needed something different, something where he could express his real talent, something that could help America in its fight against terrorism. So he joined the S.E.A.L.s in order to become a sniper. After marrying Taya (Sienna Miller), Kyle and the other members of the team are called for their first tour of Iraq. Kyle's struggle isn't with his missions, but about his relationship with the reality of the war and, once returned at home, how he manages to handle it with his urban life, his wife, and kids. —Evandro Martirano",7.3,7.2,Action,Biography,Drama,War,,,,"https://m.media-amazon.com/images/M/MV5BMTkxNzI3ODI4Nl5BMl5BanBnXkFtZTgwMjkwMjY4MjE@._V1_QL75_UX190_CR0,0,190,281_.jpg"
78,Interstellar,106,2015,Best Achievement in Visual Effects,,,,,,,2014,2h 49min,"Earth's future has been riddled by disasters, famines, and droughts. There is only one way to ensure mankind's survival: Interstellar travel. A newly discovered wormhole in the far reaches of our solar system allows a team of astronauts to go where no man has gone before, a planet that may have the right environment to sustain human life. —ahmetkozan",8.6,7.4,Adventure,Drama,Sci-Fi,,,,,"https://m.media-amazon.com/images/M/MV5BZjdkOTU3MDktN2IxOS00OGEyLWFmMjktY2FiMmZkNWIyODZiXkEyXkFqcGdeQXVyMTMxODk2OTU@._V1_QL75_UX190_CR0,0,190,281_.jpg"
79,Feast,25,2015,"Best Short Film, Animated",,,,,,,2014,6min,"Abandoned on the streets, a lively and always hungry Boston Terrier, during his night escapades for food in the dumpsters encounters a kind-hearted man who decides to take him home, naming him Winston. At last, now Winston can have all the food in the world, and as the years go by, so will his diet evolve. —Nick Riganas",8.2,0,Animation,Short,Comedy,Drama,Family,Romance,,"https://m.media-amazon.com/images/M/MV5BNDc3YTEzZDItNjE2Yy00Nzg2LTgxMDAtNWMxOTJiMWQxZmNiXkEyXkFqcGdeQXVyMjExNjgyMTc@._V1_QL75_UY281_CR1,0,190,281_.jpg"
80,The Phone Call,26,2015,"Best Short Film, Live Action",,,,,,,2013,22min,"Heather volunteers as a crisis center hot-line operator. She receives a telephone call from a tearful Stan, who is reluctant to divulge the nature of his problem. All she can initially get out of him is that he is despondent and remorseful about an event that happened two years ago, which is now making it difficult for him to continue. The call takes on some urgency for her when she learns that he has taken some prescription anti-depressants. While she tries to convince him to let her call an ambulance for him, all he really seems to want is someone - her - to figuratively hold his hand while he dies. Without any other support staff around, Heather has to use whatever clues she can glean from their conversation to provide Stan the help she wants to get to him before he dies. —Huggo",7.3,0,Short,Drama,,,,,,"https://m.media-amazon.com/images/M/MV5BNzQxNTIyODAxMV5BMl5BanBnXkFtZTgwNzQyMDA3OTE@._V1_QL75_UX190_CR0,0,190,281_.jpg"
81,Ida,27,2015,Best Foreign Language Film of the Year,,,,,,,2013,1h 22min,"Poland, 1962. Anna, an orphan brought up by nuns in the convent, is a novice. She has to see Wanda, the only living relative, before she takes her vows. Wanda tells Anna about her Jewish roots. Both women start a journey not only to find their family's tragic story, but to see who they really are and where they belong. They question what they used to believe in. —Anonymous",7.4,9.1,Drama,,,,,,,"https://m.media-amazon.com/images/M/MV5BMjU4OGI4MDctMDZlOS00ZDI5LTk2ODEtNGIyMGE5ZDY4MjQ4XkEyXkFqcGdeQXVyMTI3ODAyMzE2._V1_QL75_UY281_CR4,0,190,281_.jpg"
82,Big Hero 6,1541,2015,Best Animated Feature Film of the Year,,,,,,,2014,1h 42min,"When a devastating event befalls the city of San Fransokyo and catapults Hiro into the midst of danger, he turns to Baymax and his close friends adrenaline junkie Go Go Tomago, neatnik Wasabi, chemistry whiz Honey Lemon and fanboy Fred. Determined to uncover the mystery, Hiro transforms his friends into a band of high-tech heroes called ""Big Hero 6."" —Walt Disney Animation Studios",7.8,7.4,Animation,Action,Adventure,Comedy,Drama,Family,Sci-Fi,"https://m.media-amazon.com/images/M/MV5BMDliOTIzNmUtOTllOC00NDU3LWFiNjYtMGM0NDc1YTMxNjYxXkEyXkFqcGdeQXVyNTM3NzExMDQ@._V1_QL75_UY281_CR4,0,190,281_.jpg"
83,Crisis Hotline: Veterans Press 1,28,2015,"Best Documentary, Short Subject",,,,,,,2013,40min,"They served their country overseas. Now, many military veterans must turn to the unique services of the Veterans' Crisis Line to help with their own personal and professional traumas at home. This documentary profiles several of the VCL counselors who work the phones of this 24-hour service, providing support, guidance, and hope to active and retired servicemen dealing with emotional, physical and financial troubles. —Anonymous",7.5,0,Documentary,Short,,,,,,"https://m.media-amazon.com/images/M/MV5BMjA0NjA4NjE2Nl5BMl5BanBnXkFtZTgwNzIxNTY2NjE@._V1_QL75_UX190_CR0,0,190,281_.jpg"
84,Citizenfour,29,2015,"Best Documentary, Feature",,,,,,,2014,1h 54min,"In January 2013, Laura Poitras started receiving anonymous encrypted e-mails from ""CITIZENFOUR,"" who claimed to have evidence of illegal covert surveillance programs run by the NSA in collaboration with other intelligence agencies worldwide. Five months later, she and reporters Glenn Greenwald and Ewen MacAskill flew to Hong Kong for the first of many meetings with the man who turned out to be Edward Snowden. She brought her camera with her. The resulting film is history unfolding before our eyes. —Anonymous",8,8.8,Documentary,Biography,History,,,,,"https://m.media-amazon.com/images/M/MV5BMTc0MTM0MTA5MF5BMl5BanBnXkFtZTgwNzEwODEwMzE@._V1_QL75_UY281_CR1,0,190,281_.jpg"
85,Spotlight,856,2016,Best Motion Picture of the Year,"Best Writing, Original Screenplay",,,,,,2015,2h 9min,"When the Boston Globe's tenacious ""Spotlight"" team of reporters delves into allegations of abuse in the Catholic Church, their year-long investigation uncovers a decades-long cover-up at the highest levels of Boston's religious, legal, and government establishment, touching off a wave of revelations around the world. —Open Road",8.1,9.3,Biography,Crime,Drama,,,,,"https://m.media-amazon.com/images/M/MV5BMjIyOTM5OTIzNV5BMl5BanBnXkFtZTgwMDkzODE2NjE@._V1_QL75_UY281_CR0,0,190,281_.jpg"
86,The Revenant,424,2016,Best Performance by an Actor in a Leading Role,Best Achievement in Directing,Best Achievement in Cinematography,,,,,2015,2h 36min,"While exploring uncharted wilderness in 1823, legendary frontiersman Hugh Glass sustains injuries from a brutal bear attack. When his hunting team leaves him for dead, Glass must utilize his survival skills to find a way back home while avoiding natives on their own hunt. Grief-stricken and fueled by vengeance, Glass treks through the wintry terrain to track down John Fitzgerald, the former confidant who betrayed and abandoned him. —Jwelch5742",8,7.6,Action,Adventure,Drama,History,Western,,,"https://m.media-amazon.com/images/M/MV5BMDE5OWMzM2QtOTU2ZS00NzAyLWI2MDEtOTRlYjIxZGM0OWRjXkEyXkFqcGdeQXVyODE5NzE3OTE@._V1_QL75_UX190_CR0,0,190,281_.jpg"
87,Room,926,2016,Best Performance by an Actress in a Leading Role,,,,,,,2015,1h 58min,"ROOM tells the extraordinary story of Jack, a spirited 5-year-old who is looked after by his loving and devoted mother. Like any good mother, Ma dedicates herself to keeping Jack happy and safe, nurturing him with warmth and love and doing typical things like playing games and telling stories. Their life, however, is anything but typical--they are trapped--confined to a 10-by-10-foot space that Ma has euphemistically named Room. Ma has created a whole universe for Jack within Room, and she will stop at nothing to ensure that, even in this treacherous environment, Jack is able to live a complete and fulfilling life. But as Jack's curiosity about their situation grows, and Ma's resilience reaches its breaking point, they enact a risky plan to escape, ultimately bringing them face-to-face with what may turn out to be the scariest thing yet: the real world. —A24",8.1,8.6,Drama,Thriller,,,,,,"https://m.media-amazon.com/images/M/MV5BMjE4NzgzNzEwMl5BMl5BanBnXkFtZTgwMTMzMDE0NjE@._V1_QL75_UX190_CR0,0,190,281_.jpg"
88,Bridge of Spies,1758,2016,Best Performance by an Actor in a Supporting Role,,,,,,,2015,2h 22min,"In the cold war, a lawyer, James B. Donovan is recruited by the CIA and involved in an intense negotiation mission to release and exchange a CIA U-2 spy-plane pilot, Francis G. Powers. The pilot was arrested alive after his plane was shot down by the Soviet Union during a mission and stays in the company of a KGB intelligence officer, Rudolf Abel, who was arrested for espionage in the US. —Gusde",7.6,8.1,Drama,History,Thriller,,,,,"https://m.media-amazon.com/images/M/MV5BMjIxOTI0MjU5NV5BMl5BanBnXkFtZTgwNzM4OTk4NTE@._V1_QL75_UX190_CR0,0,190,281_.jpg"
89,The Danish Girl,1414,2016,Best Performance by an Actress in a Supporting Role,,,,,,,2015,1h 59min,"Copenhagen, Denmark, 1926. Einar Wegener (played by Eddie Redmayne) and his wife Gerda (Alicia Vikander) are a happily married couple. Both are artists, Einar preferring landscapes and she portraits. One day Einar poses for a portrait of Gerda's while wearing a dress. This is initially done as a lark, as is the later attendance at a party dressed as a woman. However, Einar soon discovers that she is in fact a woman and over time prefers being Lili. At first she and Gerda try to have her situation ""cured"" but this leads nowhere (other than to many doctors trying to have Lili locked up as a pervert and/or lunatic). Her voyage of self-discovery will ultimately lead to her undergoing the first ever sex-change operation. —grantss",7.1,6.6,Biography,Drama,Romance,,,,,"https://m.media-amazon.com/images/M/MV5BMjA0NjA4NjE2Nl5BMl5BanBnXkFtZTgwNzIxNTY2NjE@._V1_QL75_UX190_CR0,0,190,281_.jpg"
90,The Big Short,381,2016,"Best Writing, Adapted Screenplay",,,,,,,2015,2h 10min,"Three separate but parallel stories of the U.S mortgage housing crisis of 2005 are told. Michael Burry, an eccentric ex-physician turned one-eyed Scion Capital hedge fund manager, has traded traditional office attire for shorts, bare feet and a Supercuts haircut. He believes that the US housing market is built on a bubble that will burst within the next few years. Autonomy within the company allows Burry to do largely as he pleases, so Burry proceeds to bet against the housing market with the banks, who are more than happy to accept his proposal for something that has never happened in American history. The banks believe that Burry is a crackpot and therefore are confident in that they will win the deal. Jared Vennett with Deutschebank gets wind of what Burry is doing and, as an investor believes he too can cash in on Burry's beliefs. An errant telephone call to FrontPoint Partners gets this information into the hands of Mark Baum, an idealist who is fed up with the corruption in the financial industry. Baum and his associates, who work at an arms length under Morgan Stanley, decide to join forces with Vennett despite not totally trusting him. In addition to Burry's information, they further believe that most of the mortgages are overrated by the bond agencies, with the banks collating all the sub-prime mortgages under AAA packages. Charlie Geller and Jamie Shipley, who are minor players in a $30 million start-up garage company called Brownfield, get a hold of Vennett's prospectus on the matter. Wanting in on the action but not having the official clout to play, they decide to call an old ""friend"", retired investment banker Ben Rickert, to help out. All three of these groups work on the premise that the banks are stupid and don't know what's going on, while for them to win, the general economy has to lose, which means the suffering of the general investor who trusts the financial institutions. That latter aspect may not sit well with Baum. Some of these assumptions may be incorrect and may be far more manipulative than they could have ever imagined, which in turn may throw curves into the process. —Huggo",7.8,8.1,Biography,Comedy,Drama,History,,,,"https://m.media-amazon.com/images/M/MV5BNDc4MThhN2EtZjMzNC00ZDJmLThiZTgtNThlY2UxZWMzNjdkXkEyXkFqcGdeQXVyNDk3NzU2MTQ@._V1_QL75_UX190_CR0,8,190,281_.jpg"
91,Mad Max: Fury Road,174,2016,Best Achievement in Film Editing,Best Achievement in Costume Design,Best Achievement in Sound Mixing,Best Achievement in Sound Editing,Best Achievement in Production Design,Best Achievement in Makeup and Hairstyling,,2015,2h,"An apocalyptic story set in the furthest reaches of our planet, in a stark desert landscape where humanity is broken, and almost everyone is crazed fighting for the necessities of life. Within this world exist two rebels on the run who just might be able to restore order. There's Max, a man of action and a man of few words, who seeks peace of mind following the loss of his wife and child in the aftermath of the chaos. And Furiosa, a woman of action and a woman who believes her path to survival may be achieved if she can make it across the desert back to her childhood homeland. —Production",8.1,9,Action,Adventure,Sci-Fi,Thriller,,,,"https://m.media-amazon.com/images/M/MV5BN2EwM2I5OWMtMGQyMi00Zjg1LWJkNTctZTdjYTA4OGUwZjMyXkEyXkFqcGdeQXVyMTMxODk2OTU@._V1_QL75_UX190_CR0,0,190,281_.jpg"
92,Spectre,11,2016,"Best Achievement in Music Written for Motion Pictures, Original Song",,,,,,,2015,2h 28min,"A cryptic message from the past sends James Bond (Daniel Craig) on a rogue mission to Mexico City and eventually Rome, where he meets Lucia Sciarra (Monica Belluci), the beautiful and forbidden widow of an infamous criminal. Bond infiltrates a secret meeting and uncovers the existence of the sinister organisation known as S.P.E.C.T.R.E. Meanwhile, back in London, Max Denbigh (Andrew Scott), the new head of the Centre of National Security, questions Bond's actions and challenges the relevance of MI6, led by M (Ralph Fiennes). Bond covertly enlists Miss Eve Moneypenny (Naomie Harris) and Q (Ben Whishaw) to help him seek out Dr. Madeleine Swann (Léa Seydoux), the daughter of his old nemesis Mr. White (Jesper Christensen), who may hold the clue to untangling the web of S.P.E.C.T.R.E. As the daughter of the assassin, she understands Bond in a way most others cannot. As Bond ventures towards the heart of S.P.E.C.T.R.E., he learns a chilling connection between him and the enemy he seeks.",6.8,6,Action,Adventure,Thriller,,,,,"https://m.media-amazon.com/images/M/MV5BOWQ1MDE1NzgtNTQ4OC00ZjliLTllZDAtN2IyOTVmMTc5YjUxXkEyXkFqcGdeQXVyNzkwMjQ5NzM@._V1_QL75_UX190_CR0,0,190,281_.jpg"
93,The Hateful Eight,618,2016,"Best Achievement in Music Written for Motion Pictures, Original Score",,,,,,,2015,2h 48min,"Some time after the Civil War, a stagecoach hurtles through the wintry Wyoming landscape. Bounty hunter John Ruth and his fugitive captive Daisy Domergue race towards the town of Red Rock, where Ruth will bring Daisy to justice. Along the road, they encounter Major Marquis Warren (an infamous bounty hunter) and Chris Mannix (a man who claims to be Red Rock's new sheriff). Lost in a blizzard, the bunch seeks refuge at Minnie's Haberdashery. When they arrive they are greeted by unfamiliar faces: Bob, who claims to be taking care of the place while Minnie is gone; Oswaldo Mobray, the hangman of Red Rock; Joe Gage, a cow puncher; and confederate general Sanford Smithers. As the storm overtakes the mountainside, the eight travelers come to learn that they might not make it to Red Rock after all... —Jordan Crighton",7.8,6.8,Crime,Drama,Mystery,Thriller,Western,,,"https://m.media-amazon.com/images/M/MV5BMjA1MTc1NTg5NV5BMl5BanBnXkFtZTgwOTM2MDEzNzE@._V1_QL75_UX190_CR0,0,190,281_.jpg"
94,Ex Machina,417,2016,Best Achievement in Visual Effects,,,,,,,2014,1h 48min,"Caleb, a 26 year old programmer at the world's largest internet company, wins a competition to spend a week at a private mountain retreat belonging to Nathan, the reclusive CEO of the company. But when Caleb arrives at the remote location he finds that he will have to participate in a strange and fascinating experiment in which he must interact with the world's first true artificial intelligence, housed in the body of a beautiful robot girl. —DNA FILMS",7.7,7.8,Drama,Sci-Fi,Thriller,,,,,"https://m.media-amazon.com/images/M/MV5BMTUxNzc0OTIxMV5BMl5BanBnXkFtZTgwNDI3NzU2NDE@._V1_QL75_UX190_CR0,0,190,281_.jpg"
95,Historia de un oso,30,2016,"Best Short Film, Animated",,,,,,,2014,11min,"Every day, a melancholy old bear takes a mechanical diorama that he has created out to his street corner. For a coin, passersby can look into the peephole of his invention, which tells the story of a circus bear who longs to escape and return to the family from which he was taken. —Jwelch5742",7.7,0,Animation,Short,Adventure,Drama,Family,,,"https://m.media-amazon.com/images/M/MV5BMTUxMDMyMTA0OV5BMl5BanBnXkFtZTgwNjU5MjE1NjE@._V1_QL75_UX190_CR0,0,190,281_.jpg"
96,Stutterer,31,2016,"Best Short Film, Live Action",,,,,,,2015,12min,"For a lonely typographer, an online relationship has provided a much-needed connection without revealing the speech impediment that has kept him isolated. Now, however, he is faced with the proposition of meeting his online paramour in the flesh, and thereby revealing the truth about himself. —Jwelch5742",7.7,0,Short,Drama,Romance,,,,,"https://m.media-amazon.com/images/M/MV5BMTUwNTA2NzUxNl5BMl5BanBnXkFtZTgwNzIzNjczNzE@._V1_QL75_UY281_CR1,0,190,281_.jpg"
97,Saul fia,32,2016,Best Foreign Language Film of the Year,,,,,,,2015,1h 47min,"Two days in the life of Saul Auslander, Hungarian prisoner working as a member of the Sonderkommando at one of the Auschwitz Crematoriums who, to bury the corpse of a boy he takes for his son, tries to carry out his impossible deed: salvage the body and find a rabbi to bury it. While the Sonderkommando is to be liquidated at any moment, Saul turns away of the living and their plans of rebellion to save the remains of a son he never took care of when he was still alive. —LaoKoon",7.5,9.1,Drama,War,,,,,,"https://m.media-amazon.com/images/M/MV5BMjFmMzJlMTYtYmRlNy00Zjg5LThmYmYtYmE0NDk3N2MzMjRhXkEyXkFqcGdeQXVyMjc3MTAwNjg@._V1_QL75_UY281_CR4,0,190,281_.jpg"
98,Inside Out,1006,2016,Best Animated Feature Film of the Year,,,,,,,2015,1h 35min,"Growing up can be a bumpy road, and it's no exception for Riley, who is uprooted from her Midwest life when her father starts a new job in San Francisco. Like all of us, Riley is guided by her emotions - Joy, Fear, Anger, Disgust and Sadness. The emotions live in Headquarters, the control center inside Riley's mind, where they help advise her through everyday life. As Riley and her emotions struggle to adjust to a new life in San Francisco, turmoil ensues in Headquarters. Although Joy, Riley's main and most important emotion, tries to keep things positive, the emotions conflict on how best to navigate a new city, house and school. —Pixar",8.1,9.4,Animation,Adventure,Comedy,Family,,,,"https://m.media-amazon.com/images/M/MV5BOTgxMDQwMDk0OF5BMl5BanBnXkFtZTgwNjU5OTg2NDE@._V1_QL75_UX190_CR0,0,190,281_.jpg"
99,A Girl in the River,101,2016,"Best Documentary, Short Subject",,,,,,,2015,40min,"The extraordinary story of a young Pakistani woman who lived to tell of her narrow escape from an attempted ""honor"" killing by her father and uncle. Told through the lens of a true love story, the film tells the story of Saba who was shot and left for dead after marrying a man once promised to her. The result is a scathing examination of the contradictions between modernism and tradition within Pakistani society. —Jwelch5742",7.9,0,Documentary,Short,,,,,,"https://m.media-amazon.com/images/M/MV5BNWIyODQ4YjYtNDljOS00MTQyLTk1ZjUtYzQ5MDc2YjFmNzg2XkEyXkFqcGdeQXVyMTQxNzMzNDI@._V1_QL75_UY281_CR4,0,190,281_.jpg"
100,Amy,33,2016,"Best Documentary, Feature",,,,,,,2015,2h 8min,"A documentary on the life of Amy Winehouse, the immensely talented yet doomed songstress. We see her from her teen years, where she already showed her singing abilities, to her finding success and then her downward spiral into alcoholism and drugs. —grantss",7.8,8.5,Documentary,Biography,Music,,,,,"https://m.media-amazon.com/images/M/MV5BMTQ1MzE4MTE3OF5BMl5BanBnXkFtZTgwOTcyNDM3NTE@._V1_QL75_UX190_CR0,0,190,281_.jpg"
101,Moonlight,1189,2017,Best Motion Picture of the Year,Best Performance by an Actor in a Supporting Role,Best Adapted Screenplay,,,,,2016,1h 51min,"Three time periods - young adolescence, mid-teen and young adult - in the life of black-American Chiron is presented. When a child, Chiron lives with his single, crack addict mother Paula in a crime ridden neighborhood in Miami. Chiron is a shy, withdrawn child largely due to his small size and being neglected by his mother, who is more concerned about getting her fixes and satisfying her carnal needs than taking care of him. Because of these issues, Chiron is bullied, the slurs hurled at him which he doesn't understand beyond knowing that they are meant to be hurtful. Besides his same aged Cuban-American friend Kevin, Chiron is given what little guidance he has in life from a neighborhood drug dealer named Juan, who can see that he is neglected, and Juan's caring girlfriend Teresa, whose home acts as a sanctuary away from the bullies and away from Paula's abuse. With this childhood as a foundation, Chiron may have a predetermined path in life, one that will only be magnified in terms of its problems when he reaches his difficult teen years when peer pressure affects what he and many of his peers do, unless he follows Juan's advice of truly making his own decisions for himself. —Huggo",7.4,9.9,Drama,,,,,,,"https://m.media-amazon.com/images/M/MV5BNzQxNTIyODAxMV5BMl5BanBnXkFtZTgwNzQyMDA3OTE@._V1_QL75_UX190_CR0,0,190,281_.jpg"
102,Manchester by the Sea,1210,2017,Best Performance by an Actor in a Leading Role,Best Original Screenplay,,,,,,2016,2h 17min,"Lee Chandler is a brooding, irritable loner who works as a handyman for a Boston apartment block. One damp winter day he gets a call summoning him to his hometown, north of the city. His brother's heart has given out suddenly, and he's been named guardian to his 16-year-old nephew. As if losing his only sibling and doubts about raising a teenager weren't enough, his return to the past re-opens an unspeakable tragedy. —Jwelch5742",7.8,9.6,Drama,,,,,,,"https://m.media-amazon.com/images/M/MV5BMTYxMjk0NDg4Ml5BMl5BanBnXkFtZTgwODcyNjA5OTE@._V1_QL75_UX190_CR0,0,190,281_.jpg"
103,La La Land,624,2017,Best Performance by an Actress in a Leading Role,Best Achievement in Directing,Best Achievement in Cinematography,Best Achievement in Production Design,Best Achievement in Music Written for Motion Pictures (Original Score),Best Achievement in Music Written for Motion Pictures (Original Song),,2016,2h 8min,"Aspiring actress serves lattes to movie stars in between auditions and jazz musician Sebastian scrapes by playing cocktail-party gigs in dingy bars. But as success mounts, they are faced with decisions that fray the fragile fabric of their love affair, and the dreams they worked so hard to maintain in each other threaten to rip them apart. —Eirini",8,9.4,Comedy,Drama,Music,Musical,Romance,,,"https://m.media-amazon.com/images/M/MV5BMzUzNDM2NzM2MV5BMl5BanBnXkFtZTgwNTM3NTg4OTE@._V1_QL75_UX190_CR0,0,190,281_.jpg"
104,Fences,2586,2017,Best Performance by an Actress in a Supporting Role,,,,,,,2016,2h 19min,"Troy Maxson makes his living as a sanitation worker in 1950s Pittsburgh. Maxson once dreamed of becoming a professional baseball player, but was deemed too old when the major leagues began admitting black athletes. Bitter over his missed opportunity, Troy creates further tension in his family when he squashes his son's chance to meet a college football recruiter. —Jwelch5742",7.2,7.9,Drama,,,,,,,"https://m.media-amazon.com/images/M/MV5BOTg0Nzc1NjA0MV5BMl5BanBnXkFtZTgwNTcyNDQ0MDI@._V1_QL75_UX190_CR0,8,190,281_.jpg"
105,Hacksaw Ridge,423,2017,Best Achievement in Film Editing,Best Achievement in Sound Mixing,,,,,,2016,2h 19min,"The true story of Desmond T. Doss, the conscientious objector who, at the Battle of Okinawa, was awarded the Medal of Honor for his incredible bravery and regard for his fellow soldiers. We see his upbringing and how this shaped his views, especially his religious view and anti-killing stance. We see Doss's trials and tribulations after enlisting in the US Army and trying to become a medic. Finally, we see the hell on Earth that was Hacksaw Ridge. —grantss",8.1,7.1,Biography,Drama,History,War,,,,"https://m.media-amazon.com/images/M/MV5BMjQ1NjM3MTUxNV5BMl5BanBnXkFtZTgwMDc5MTY5OTE@._V1_QL75_UX190_CR0,6,190,281_.jpg"
